196340,2447449,2024-03-21T00:00:00.000+00:00,2025,https://www.iucnredlist.org/species/196340/2447449,"Williams, J.T., Carpenter, K.E., Dinh Minh, Q. & Jaafar, Z. 2025. Parioglossus galzini. The IUCN Red List of Threatened Species 2025: e.T196340A2447449. Accessed on 29 June 2026.",Parioglossus galzini,,CR,Decreasing,,80,80,species,,[],ACTINOPTERYGII,MARINEFISH,CR,Fishes (not comprehensive),True,False,CR,-144.33700497406002,-27.608527487491777,range_polygon,1,1,1,1,1,200,1.0,1,Extant,1,Resident,196340,self,30207.69157956549,30207.69157956549,30207.69157956549,,MARINEFISH_PART6.shp,IUCN Marine Biodiversity Unit,2024,IUCN 2025. The IUCN Red List of Threatened Species. Version 2025-2. https://www.iucnredlist.org. Downloaded on 14 June 2026.,10 October 2025,IUCN Marine Biodiversity Unit 2024. The IUCN Red List of Threatened Species. Version 2025-2. https://www.iucnredlist.org. Downloaded on 14 June 2026.,196340,self,Parioglossus_galzini,en,en.wikipedia.org,https://en.wikipedia.org/wiki/Parioglossus_galzini,https://www.wikidata.org/entity/Q2054715,,100
196674,143863981,2017-02-28T00:00:00.000+00:00,2018,https://www.iucnredlist.org/species/196674/143863981,"Caruso, J., Robertson, R., Munroe, T.A., Palla, H.P., Nanola, C., Arceo, H., Williams, J., Di Dario, F., Muallil, R. & Acosta, A.K.M. 2018. Neoopisthopterus cubanus (errata version published in 2019). The IUCN Red List of Threatened Species 2018: e.T196674A143863981. Accessed on 29 June 2026.",Neoopisthopterus cubanus,Cuban Longfin Herring,VU,Unknown,,1999,23595,species,,[],ACTINOPTERYGII,MARINEFISH,VU,Fishes (not comprehensive),True,False,VU,-83.58985471882947,23.05438154066966,range_polygon,1,1,2,1,2,200,1.0,1,Extant,1,Resident,196674,self,51770.477773152605,51770.477773152605,51770.477773152605,,MARINEFISH_PART2.shp,IUCN Marine Biodiversity Unit/GMSA,2018,IUCN 2025. The IUCN Red List of Threatened Species. Version 2025-2. https://www.iucnredlist.org. Downloaded on 14 June 2026.,10 October 2025,IUCN Marine Biodiversity Unit/GMSA 2018. The IUCN Red List of Threatened Species. Version 2025-2. https://www.iucnredlist.org. Downloaded on 14 June 2026.,196674,self,古巴新後鰭魚,zh,zh.wikipedia.org,https://zh.wikipedia.org/wiki/%E5%8F%A4%E5%B7%B4%E6%96%B0%E5%BE%8C%E9%B0%AD%E9%AD%9A,https://www.wikidata.org/entity/Q2880855,,183
196678,2473113,2014-01-09T00:00:00.000+00:00,2015,https://www.iucnredlist.org/species/196678/2473113,"Collette, B., Grubbs, D., Pezold, F., Simons, J., Caruso, J., Carlson, J., McEachran, J.D., Brenner, J., Tornabene, L., Chakrabarty, P., Robertson, R., Chao, L., Tolan, J., Vega-Cendejas, M., Espinosa-Perez, H. & Jelks, H. 2015. Fundulus jenkinsi. The IUCN Red List of Threatened Species 2015: e.T196678A2473113. Accessed on 29 June 2026.",Fundulus jenkinsi,Saltmarsh Topminnow,VU,Unknown,,1999,163078,species,,[],ACTINOPTERYGII,MARINEFISH,VU,Fishes (not comprehensive),True,False,VU,-91.5088208008758,29.269782092352703,range_polygon,1,1,9,1,9,200,1.0,1,Extant,1,Resident,196678,self,235499.7281773576,235499.7281773576,235499.7281773576,,MARINEFISH_PART4.shp,NatureServe,2015,IUCN 2025. The IUCN Red List of Threatened Species. Version 2025-2. https://www.iucnredlist.org. Downloaded on 14 June 2026.,10 October 2025,NatureServe 2015. The IUCN Red List of Threatened Species. Version 2025-2. https://www.iucnredlist.org. Downloaded on 14 June 2026.,196678,self,Saltmarsh_topminnow,en,en.wikipedia.org,https://en.wikipedia.org/wiki/Saltmarsh_topminnow,https://www.wikidata.org/entity/Q2972806,https://commons.wikimedia.org/wiki/Special:FilePath/FMIB%2034264%20Zygonectes%20jenkinsi%2C%20sp%20nov.jpeg,294
198582,15543624,2014-07-23T01:00:00.000+01:00,2015,https://www.iucnredlist.org/species/198582/15543624,"Tous, P., Sidibé, A, Mbye, E., de Morais, L., Camara, K., Munroe, T., Adeofe, T.A., Camara, Y.H., Djiman, R., Sagna, A. & Sylla, M. 2015. Sardinella maderensis. The IUCN Red List of Threatened Species 2015: e.T198582A15543624. Accessed on 29 June 2026.",Sardinella maderensis,Madeiran Sardinella,VU,Unknown,,,,species,,[],ACTINOPTERYGII,MARINEFISH,VU,Fishes (not comprehensive),True,False,VU,-16.0933382809379,32.75283430948333,range_polygon,1,1,14,1,14,200,1.0,1,Extant,1,Resident,198582,self,2888791.604670145,2888791.604670145,2888791.604670145,,MARINEFISH_PART9.shp,International Union for Conservation of Nature,2015,IUCN 2025. The IUCN Red List of Threatened Species. Version 2025-2. https://www.iucnredlist.org. Downloaded on 14 June 2026.,10 October 2025,International Union for Conservation of Nature 2015. The IUCN Red List of Threatened Species. Version 2025-2. https://www.iucnredlist.org. Downloaded on 14 June 2026.,198582,self,Sardinella_maderensis,en,en.wikipedia.org,https://en.wikipedia.org/wiki/Sardinella_maderensis,https://www.wikidata.org/entity/Q2124267,https://commons.wikimedia.org/wiki/Special:FilePath/Sardinella%20maderensis.jpg,1085
198647,43157137,2013-05-09T01:00:00.000+01:00,2015,https://www.iucnredlist.org/species/198647/43157137,"Smith-Vaniz, W.F., Sidibe, A., Nunoo, F., Lindeman, K., Williams, A.B., Quartey, R., Camara, K., Carpenter, K.E., Montiero, V., de Morais, L., Djiman, R., Sylla, M. & Sagna, A. 2015. Trachurus trachurus. The IUCN Red List of Threatened Species 2015: e.T198647A43157137. Accessed on 29 June 2026.",Trachurus trachurus,Atlantic Horse Mackerel,VU,Decreasing,,,,species,,[],ACTINOPTERYGII,MARINEFISH,VU,Fishes (not comprehensive),True,False,VU,-17.572474207922646,63.11889648271698,range_polygon,1,1,14,2,13,200,0.999998996217401,1,Extant,1,Resident,198647,self,9327094.521990804,9327085.159615625,9327085.159615625,,MARINEFISH_PART1.shp,International Union for Conservation of Nature,2015,IUCN 2025. The IUCN Red List of Threatened Species. Version 2025-2. https://www.iucnredlist.org. Downloaded on 14 June 2026.,10 October 2025,International Union for Conservation of Nature 2015. The IUCN Red List of Threatened Species. Version 2025-2. https://www.iucnredlist.org. Downloaded on 14 June 2026.,198647,self,Atlantic_horse_mackerel,en,en.wikipedia.org,https://en.wikipedia.org/wiki/Atlantic_horse_mackerel,https://www.wikidata.org/entity/Q842956,https://commons.wikimedia.org/wiki/Special:FilePath/Trachurus%20trachurus%20France%201.jpg,28476
202019,2732047,2017-07-19T01:00:00.000+01:00,2020,https://www.iucnredlist.org/species/202019/2732047,"Larson, H. 2020. Acentrogobius griseus. The IUCN Red List of Threatened Species 2020: e.T202019A2732047. Accessed on 29 June 2026.",Acentrogobius griseus,Grey Goby,VU,Unknown,,2000,,species,,[],ACTINOPTERYGII,MARINEFISH,VU,Fishes (not comprehensive),True,False,VU,80.34778720624868,11.90841673665313,range_polygon,1,1,3,1,3,200,1.0,1,Extant,1,Resident,202019,self,68724.35965941021,68724.35965941021,68724.35965941021,,MARINEFISH_PART8.shp,IUCN Marine Biodiversity Unit/GMSA,2019,IUCN 2025. The IUCN Red List of Threatened Species. Version 2025-2. https://www.iucnredlist.org. Downloaded on 14 June 2026.,10 October 2025,IUCN Marine Biodiversity Unit/GMSA 2019. The IUCN Red List of Threatened Species. Version 2025-2. https://www.iucnredlist.org. Downloaded on 14 June 2026.,202019,self,Acentrogobius_griseus,es,es.wikipedia.org,https://es.wikipedia.org/wiki/Acentrogobius_griseus,https://www.wikidata.org/entity/Q2137295,https://commons.wikimedia.org/wiki/Special:FilePath/Gobius%20griseus%20Ford%2063.jpg,54
202038,2732189,2019-08-16T01:00:00.000+01:00,2020,https://www.iucnredlist.org/species/202038/2732189,"Nair, R., Munroe, T.A. & Weerts, S.P. 2020. Cynoglossus macrostomus. The IUCN Red List of Threatened Species 2020: e.T202038A2732189. Accessed on 29 June 2026.",Cynoglossus macrostomus,Malabar Tonguesole,VU,Unknown,,,,species,,[],ACTINOPTERYGII,MARINEFISH,VU,Fishes (not comprehensive),True,False,VU,73.60856850770125,14.74959706910579,range_polygon,1,1,2,1,2,200,1.0,1,Extant,1,Resident,202038,self,467650.42519148765,467650.42519148765,467650.42519148765,,MARINEFISH_PART6.shp,IUCN Marine Biodiversity Unit/GMSA,2020,IUCN 2025. The IUCN Red List of Threatened Species. Version 2025-2. https://www.iucnredlist.org. Downloaded on 14 June 2026.,10 October 2025,IUCN Marine Biodiversity Unit/GMSA 2020. The IUCN Red List of Threatened Species. Version 2025-2. https://www.iucnredlist.org. Downloaded on 14 June 2026.,202038,self,Cynoglossus_macrostomus,es,es.wikipedia.org,https://es.wikipedia.org/wiki/Cynoglossus_macrostomus,https://www.wikidata.org/entity/Q2297403,,35
202632,46958684,2015-06-12T01:00:00.000+01:00,2015,https://www.iucnredlist.org/species/202632/46958684,"Munroe, T. 2015. Paralichthys lethostigma. The IUCN Red List of Threatened Species 2015: e.T202632A46958684. Accessed on 29 June 2026.",Paralichthys lethostigma,Southern Flounder,NT,Decreasing,,,,species,,[],ACTINOPTERYGII,MARINEFISH,NT,Fishes (not comprehensive),True,False,NT,-80.01039638628188,31.961668921590658,range_polygon,1,1,4,1,4,200,1.0,1,Extant,1,Resident,202632,self,495225.2237506632,495225.2237506632,495225.2237506632,,MARINEFISH_PART8.shp,International Union for Conservation of Nature,2015,IUCN 2025. The IUCN Red List of Threatened Species. Version 2025-2. https://www.iucnredlist.org. Downloaded on 14 June 2026.,10 October 2025,International Union for Conservation of Nature 2015. The IUCN Red List of Threatened Species. Version 2025-2. https://www.iucnredlist.org. Downloaded on 14 June 2026.,202632,self,Paralichthys_lethostigma,en,en.wikipedia.org,https://en.wikipedia.org/wiki/Paralichthys_lethostigma,https://www.wikidata.org/entity/Q7134909,https://commons.wikimedia.org/wiki/Special:FilePath/Paralichthys%20lethostigma.jpg,4495
15522149,15603540,2012-07-11T01:00:00.000+01:00,2015,https://www.iucnredlist.org/species/15522149/15603540,"Iwamoto, T. 2015. Coryphaenoides rupestris. The IUCN Red List of Threatened Species 2015: e.T15522149A15603540. Accessed on 29 June 2026.",Coryphaenoides rupestris,Roundnose Grenadier,CR,Unknown,,,,species,,[],ACTINOPTERYGII,MARINEFISH,CR,Fishes (not comprehensive),True,False,CR,-29.927053497549192,57.57890468983979,range_polygon,1,1,14,2,13,200,0.9985349009718316,1,Extant,1,Resident,15522149,self,4372842.69101901,4366436.043442065,4366436.043442065,,MARINEFISH_PART9.shp,International Union for Conservation of Nature,2015,IUCN 2025. The IUCN Red List of Threatened Species. Version 2025-2. https://www.iucnredlist.org. Downloaded on 14 June 2026.,10 October 2025,International Union for Conservation of Nature 2015. The IUCN Red List of Threatened Species. Version 2025-2. https://www.iucnredlist.org. Downloaded on 14 June 2026.,15522149,self,Coryphaenoides_rupestris,en,en.wikipedia.org,https://en.wikipedia.org/wiki/Coryphaenoides_rupestris,https://www.wikidata.org/entity/Q2176319,https://commons.wikimedia.org/wiki/Special:FilePath/Coryphaenoides%20rupestris.jpg,2258
15522229,15603615,2012-07-12T01:00:00.000+01:00,2015,https://www.iucnredlist.org/species/15522229/15603615,"Iwamoto, T. 2015. Merluccius senegalensis. The IUCN Red List of Threatened Species 2015: e.T15522229A15603615. Accessed on 29 June 2026.",Merluccius senegalensis,Senegalese Hake,EN,Decreasing,,,,species,,[],ACTINOPTERYGII,MARINEFISH,EN,Fishes (not comprehensive),True,False,EN,-17.07107719548025,22.395825136884625,range_polygon,1,1,1,1,1,200,1.0,1,Extant,1,Resident,15522229,self,294072.66310608626,294072.66310608626,294072.66310608626,,MARINEFISH_PART2.shp,International Union for Conservation of Nature,2015,IUCN 2025. The IUCN Red List of Threatened Species. Version 2025-2. https://www.iucnredlist.org. Downloaded on 14 June 2026.,10 October 2025,International Union for Conservation of Nature 2015. The IUCN Red List of Threatened Species. Version 2025-2. https://www.iucnredlist.org. Downloaded on 14 June 2026.,15522229,self,Merluccius_senegalensis,en,en.wikipedia.org,https://en.wikipedia.org/wiki/Merluccius_senegalensis,https://www.wikidata.org/entity/Q2100255,,306
15602438,15604015,2014-05-20T01:00:00.000+01:00,2015,https://www.iucnredlist.org/species/15602438/15604015,"Adeofe, T.A., Camara, K., Camara, Y.H., Cissoko, K., Djiman, R., Mbye, E., Munroe, T., Sidibe, A., Tous, P., de Morais, L., Sagna, A. & Sylla, M. 2015. Cynoglossus canariensis. The IUCN Red List of Threatened Species 2015: e.T15602438A15604015. Accessed on 29 June 2026.",Cynoglossus canariensis,Canary Tonguesole,NT,Stable,,,,species,,[],ACTINOPTERYGII,MARINEFISH,NT,Fishes (not comprehensive),True,False,NT,-24.236351140731276,16.022662149105706,range_polygon,1,1,8,1,8,200,1.0,1,Extant,1,Resident,15602438,self,1754706.593993492,1754706.593993492,1754706.593993492,,MARINEFISH_PART4.shp,International Union for Conservation of Nature,2015,IUCN 2025. The IUCN Red List of Threatened Species. Version 2025-2. https://www.iucnredlist.org. Downloaded on 14 June 2026.,10 October 2025,International Union for Conservation of Nature 2015. The IUCN Red List of Threatened Species. Version 2025-2. https://www.iucnredlist.org. Downloaded on 14 June 2026.,15602438,self,Cynoglossus_canariensis,en,en.wikipedia.org,https://en.wikipedia.org/wiki/Cynoglossus_canariensis,https://www.wikidata.org/entity/Q2718755,https://commons.wikimedia.org/wiki/Special:FilePath/Cycan%20u0.png,263
15602466,15604025,2013-08-17T01:00:00.000+01:00,2015,https://www.iucnredlist.org/species/15602466/15604025,"Adeofe, T.A., Camara, K., Camara, Y.H., Cissoko, K., Djiman, R., Mbye, E., Munroe, T., Sidibe, A., Tous, P., de Morais, L., Sagna, A. & Sylla, M. 2015. Cynoglossus monodi. The IUCN Red List of Threatened Species 2015: e.T15602466A15604025. Accessed on 29 June 2026.",Cynoglossus monodi,Guinean tonguesole,NT,Unknown,,,,species,,[],ACTINOPTERYGII,MARINEFISH,NT,Fishes (not comprehensive),True,False,NT,-13.754461979280949,8.188782206509156,range_polygon,1,1,1,1,1,200,1.0,1,Extant,1,Resident,15602466,self,679458.2582141823,679458.2582141823,679458.2582141823,,MARINEFISH_PART6.shp,International Union for Conservation of Nature,2015,IUCN 2025. The IUCN Red List of Threatened Species. Version 2025-2. https://www.iucnredlist.org. Downloaded on 14 June 2026.,10 October 2025,International Union for Conservation of Nature 2015. The IUCN Red List of Threatened Species. Version 2025-2. https://www.iucnredlist.org. Downloaded on 14 June 2026.,15602466,self,Cynoglossus_monodi,fr,fr.wikipedia.org,https://fr.wikipedia.org/wiki/Cynoglossus_monodi,https://www.wikidata.org/entity/Q367264,,43
15602947,15604030,2012-05-15T01:00:00.000+01:00,2015,https://www.iucnredlist.org/species/15602947/15604030,"Adeofe, T.A., Camara, K., Camara, Y.H., Cissoko, K., Mbye, E., Munroe, T., Sidibe, A., Tous, P., de Morais, L., Sagna, A. & Sylla, M. 2015. Cynoglossus senegalensis. The IUCN Red List of Threatened Species 2015: e.T15602947A15604030. Accessed on 29 June 2026.",Cynoglossus senegalensis,Senegalese Tonguesole,NT,Stable,,,,species,,[],ACTINOPTERYGII,MARINEFISH,NT,Fishes (not comprehensive),True,False,NT,-1.909319741625925,4.282630369679535,range_polygon,1,1,1,1,1,200,1.0,1,Extant,1,Resident,15602947,self,795271.4663539649,795271.4663539649,795271.4663539649,,MARINEFISH_PART7.shp,International Union for Conservation of Nature,2015,IUCN 2025. The IUCN Red List of Threatened Species. Version 2025-2. https://www.iucnredlist.org. Downloaded on 14 June 2026.,10 October 2025,International Union for Conservation of Nature 2015. The IUCN Red List of Threatened Species. Version 2025-2. https://www.iucnredlist.org. Downloaded on 14 June 2026.,15602947,self,Cynoglossus_senegalensis,fr,fr.wikipedia.org,https://fr.wikipedia.org/wiki/Cynoglossus_senegalensis,https://www.wikidata.org/entity/Q2200985,,849
15622639,15623347,2019-08-13T01:00:00.000+01:00,2020,https://www.iucnredlist.org/species/15622639/15623347,"Weerts, S.P., Munroe, T.A. & Nair, R. 2020. Heteromycteris capensis. The IUCN Red List of Threatened Species 2020: e.T15622639A15623347. Accessed on 29 June 2026.",Heteromycteris capensis,Cape Sole,NT,Unknown,,140-2000,,species,,[],ACTINOPTERYGII,MARINEFISH,NT,Fishes (not comprehensive),True,False,NT,16.193872478400948,-29.53036976995836,range_polygon,1,1,9,1,9,200,1.0,1,Extant,1,Resident,15622639,self,372784.14350594697,372784.14350594697,372784.14350594697,,MARINEFISH_PART2.shp,IUCN Marine Biodiversity Unit/GMSA,2020,IUCN 2025. The IUCN Red List of Threatened Species. Version 2025-2. https://www.iucnredlist.org. Downloaded on 14 June 2026.,10 October 2025,IUCN Marine Biodiversity Unit/GMSA 2020. The IUCN Red List of Threatened Species. Version 2025-2. https://www.iucnredlist.org. Downloaded on 14 June 2026.,15622639,self,Heteromycteris_capensis,en,en.wikipedia.org,https://en.wikipedia.org/wiki/Heteromycteris_capensis,https://www.wikidata.org/entity/Q2893892,https://commons.wikimedia.org/wiki/Special:FilePath/Cape%20sole%20at%20Windmill%20Beach%20PA111798.JPG,154
16466393,16509787,2015-01-06T00:00:00.000+00:00,2015,https://www.iucnredlist.org/species/16466393/16509787,"Carpenter, K.E. 2015. Merluccius bilinearis. The IUCN Red List of Threatened Species 2015: e.T16466393A16509787. Accessed on 29 June 2026.",Merluccius bilinearis,Silver Hake,NT,Unknown,,,,species,,[],ACTINOPTERYGII,MARINEFISH,NT,Fishes (not comprehensive),True,False,NT,-74.03276775456288,38.76152993855676,range_polygon,1,1,1,1,1,200,1.0,1,Extant,1,Resident,16466393,self,1261232.395989237,1261232.395989237,1261232.395989237,,MARINEFISH_PART9.shp,International Union for Conservation of Nature,2015,IUCN 2025. The IUCN Red List of Threatened Species. Version 2025-2. https://www.iucnredlist.org. Downloaded on 14 June 2026.,10 October 2025,International Union for Conservation of Nature 2015. The IUCN Red List of Threatened Species. Version 2025-2. https://www.iucnredlist.org. Downloaded on 14 June 2026.,16466393,self,Silver_hake,en,en.wikipedia.org,https://en.wikipedia.org/wiki/Silver_hake,https://www.wikidata.org/entity/Q2554744,https://commons.wikimedia.org/wiki/Special:FilePath/Merluccius%20bilinearis.jpg,5868
16545046,16546277,2013-01-29T00:00:00.000+00:00,2015,https://www.iucnredlist.org/species/16545046/16546277,"Aiken, K.A., Collette, B., Dooley, J., Kishore, R., Marechal, J., Pina Amargos, F. & Singh-Renton, S. 2015. Lopholatilus chamaeleonticeps. The IUCN Red List of Threatened Species 2015: e.T16545046A16546277. Accessed on 29 June 2026.",Lopholatilus chamaeleonticeps,Golden Tilefish,EN,Decreasing,,,,species,,[],ACTINOPTERYGII,MARINEFISH,EN,Fishes (not comprehensive),True,False,EN,-79.63217703344391,32.78982441221692,range_polygon,1,1,24,2,23,200,0.814740415081494,1,Extant,1,Resident,16545046,self,1248256.7567081049,1017005.2280886408,1017005.2280886408,,MARINEFISH_PART8.shp,International Union for Conservation of Nature,2015,IUCN 2025. The IUCN Red List of Threatened Species. Version 2025-2. https://www.iucnredlist.org. Downloaded on 14 June 2026.,10 October 2025,International Union for Conservation of Nature 2015. The IUCN Red List of Threatened Species. Version 2025-2. https://www.iucnredlist.org. Downloaded on 14 June 2026.,16545046,self,Great_northern_tilefish,en,en.wikipedia.org,https://en.wikipedia.org/wiki/Great_northern_tilefish,https://www.wikidata.org/entity/Q198572,https://commons.wikimedia.org/wiki/Special:FilePath/Great%20northern%20tilefish.jpg,7617
16759101,86415416,2020-01-07T00:00:00.000+00:00,2020,https://www.iucnredlist.org/species/16759101/86415416,"Moran, B.M. & Puebla, O. 2020. Hypoplectrus maya. The IUCN Red List of Threatened Species 2020: e.T16759101A86415416. Accessed on 29 June 2026.",Hypoplectrus maya,Maya Hamlet,EN,Decreasing,,360,871,species,,[],ACTINOPTERYGII,MARINEFISH,EN,Fishes (not comprehensive),True,False,EN,-88.23082751454572,16.42562923544872,range_polygon,1,1,1,1,1,200,1.0,1,Extant,1,Resident,16759101,self,1197.0133549683817,1197.0133549683817,1197.0133549683817,,MARINEFISH_PART4.shp,IUCN Marine Biodiversity Unit/GMSA,2020,IUCN 2025. The IUCN Red List of Threatened Species. Version 2025-2. https://www.iucnredlist.org. Downloaded on 14 June 2026.,10 October 2025,IUCN Marine Biodiversity Unit/GMSA 2020. The IUCN Red List of Threatened Species. Version 2025-2. https://www.iucnredlist.org. Downloaded on 14 June 2026.,16759101,self,Hypoplectrus_maya,ru,ru.wikipedia.org,https://ru.wikipedia.org/wiki/Hypoplectrus_maya,https://www.wikidata.org/entity/Q5602553,,68
18177478,42691864,2013-05-13T01:00:00.000+01:00,2015,https://www.iucnredlist.org/species/18177478/42691864,"Camara, K., Carpenter, K.E., Djiman, R., Nunoo, F., Sagna, A., Sidibé, A, Sylla, M., de Morais, L., Quartey, R. & Lindeman, K. 2015. Pseudupeneus prayensis. The IUCN Red List of Threatened Species 2015: e.T18177478A42691864. Accessed on 29 June 2026.",Pseudupeneus prayensis,West African Goatfish,VU,Decreasing,,,,species,,[],ACTINOPTERYGII,MARINEFISH,VU,Fishes (not comprehensive),True,False,VU,2.564084772890316,5.6170246364382095,range_polygon,1,1,4,2,3,200,0.9928760716378068,1,Extant,1,Resident,18177478,self,962830.9050709802,955971.7666783488,955971.7666783488,,MARINEFISH_PART3.shp,International Union for Conservation of Nature,2015,IUCN 2025. The IUCN Red List of Threatened Species. Version 2025-2. https://www.iucnredlist.org. Downloaded on 14 June 2026.,10 October 2025,International Union for Conservation of Nature 2015. The IUCN Red List of Threatened Species. Version 2025-2. https://www.iucnredlist.org. Downloaded on 14 June 2026.,18177478,self,Pseudupeneus_prayensis,en,en.wikipedia.org,https://en.wikipedia.org/wiki/Pseudupeneus_prayensis,https://www.wikidata.org/entity/Q2213005,https://commons.wikimedia.org/wiki/Special:FilePath/FMIB%2045827%20Pseudupeneus%20prayensis.jpeg,420
18214757,162704857,2021-02-12T00:00:00.000+00:00,2022,https://www.iucnredlist.org/species/18214757/162704857,"Cadrin, S., González Troncoso, D., Nimmegeers, S., Vansteenbrugge, L., Wheeland, L. & Munroe, T.A. 2022. Glyptocephalus cynoglossus. The IUCN Red List of Threatened Species 2022: e.T18214757A162704857. Accessed on 29 June 2026.",Glyptocephalus cynoglossus,Witch Flounder,VU,Decreasing,,,,species,,[],ACTINOPTERYGII,MARINEFISH,VU,Fishes (not comprehensive),True,False,VU,0.067191045506218,59.25987620944431,range_polygon,1,2,77,3,35,200,0.5554690392225299,1,Extant,1,Resident,18214757,self,2825803.900058459,1569646.57739675,1569646.57739675,,MARINEFISH_PART7.shp,IUCN Marine Biodiversity Unit/GMSA,2021,IUCN 2025. The IUCN Red List of Threatened Species. Version 2025-2. https://www.iucnredlist.org. Downloaded on 14 June 2026.,10 October 2025,IUCN Marine Biodiversity Unit/GMSA 2021. The IUCN Red List of Threatened Species. Version 2025-2. https://www.iucnredlist.org. Downloaded on 14 June 2026.,18214757,self,Witch_(righteye_flounder),en,en.wikipedia.org,https://en.wikipedia.org/wiki/Witch_(righteye_flounder),https://www.wikidata.org/entity/Q595377,https://commons.wikimedia.org/wiki/Special:FilePath/Flatfish%202011.jpg,8737
18214757,162704857,2021-02-12T00:00:00.000+00:00,2022,https://www.iucnredlist.org/species/18214757/162704857,"Cadrin, S., González Troncoso, D., Nimmegeers, S., Vansteenbrugge, L., Wheeland, L. & Munroe, T.A. 2022. Glyptocephalus cynoglossus. The IUCN Red List of Threatened Species 2022: e.T18214757A162704857. Accessed on 29 June 2026.",Glyptocephalus cynoglossus,Witch Flounder,VU,Decreasing,,,,species,,[],ACTINOPTERYGII,MARINEFISH,VU,Fishes (not comprehensive),True,False,VU,-60.817198075910255,45.169056839501614,range_polygon,2,2,77,3,24,200,0.3714074478714151,1,Extant,1,Resident,18214757,self,2825803.900058459,1049524.6147058038,1049524.6147058038,,MARINEFISH_PART7.shp,IUCN Marine Biodiversity Unit/GMSA,2021,IUCN 2025. The IUCN Red List of Threatened Species. Version 2025-2. https://www.iucnredlist.org. Downloaded on 14 June 2026.,10 October 2025,IUCN Marine Biodiversity Unit/GMSA 2021. The IUCN Red List of Threatened Species. Version 2025-2. https://www.iucnredlist.org. Downloaded on 14 June 2026.,18214757,self,Witch_(righteye_flounder),en,en.wikipedia.org,https://en.wikipedia.org/wiki/Witch_(righteye_flounder),https://www.wikidata.org/entity/Q595377,https://commons.wikimedia.org/wiki/Special:FilePath/Flatfish%202011.jpg,8737
18214783,162705101,2021-02-12T00:00:00.000+00:00,2022,https://www.iucnredlist.org/species/18214783/162705101,"Cadrin, S., González Troncoso, D., Wheeland, L. & Munroe, T.A. 2022. Hippoglossoides platessoides. The IUCN Red List of Threatened Species 2022: e.T18214783A162705101. Accessed on 29 June 2026.",Hippoglossoides platessoides,American Plaice,EN,Decreasing,,,,species,,[],ACTINOPTERYGII,MARINEFISH,EN,Fishes (not comprehensive),True,False,EN,-17.957550922694345,66.62804066387481,range_polygon,1,1,88,2,87,200,0.999999115452466,1,Extant,1,Resident,18214783,self,7032634.039036937,7032627.81833784,7032627.81833784,,MARINEFISH_PART8.shp,IUCN Marine Biodiversity Unit/GMSA,2021,IUCN 2025. The IUCN Red List of Threatened Species. Version 2025-2. https://www.iucnredlist.org. Downloaded on 14 June 2026.,10 October 2025,IUCN Marine Biodiversity Unit/GMSA 2021. The IUCN Red List of Threatened Species. Version 2025-2. https://www.iucnredlist.org. Downloaded on 14 June 2026.,18214783,self,American_plaice,en,en.wikipedia.org,https://en.wikipedia.org/wiki/American_plaice,https://www.wikidata.org/entity/Q1234702,https://commons.wikimedia.org/wiki/Special:FilePath/Plie%20canadienne%20%28Hippoglossoides%20platessoides%29.jpg,5139
