185952,1793815,2010-03-01T00:00:00.000+00:00,2015,https://www.iucnredlist.org/species/185952/1793815,"Pezold, F., van Tassell, J., Aiken, K.A., Tornabene, L. & Bouchereau, J.-L. 2015. Coryphopterus thrix. The IUCN Red List of Threatened Species 2015: e.T185952A1793815. Accessed on 29 June 2026.",Coryphopterus thrix,Bartail Goby,VU,Unknown,,11154,,species,,[],ACTINOPTERYGII,MARINEFISH,VU,Fishes (not comprehensive),True,False,VU,-74.53298932830306,17.92712073245841,range_polygon,1,1,3,2,2,200,0.9971895906421496,1,Extant,1,Resident,185952,self,2185277.006809223,2179135.483859792,2179135.483859792,,MARINEFISH_PART8.shp,International Union for Conservation of Nature (IUCN),2015,IUCN 2025. The IUCN Red List of Threatened Species. Version 2025-2. https://www.iucnredlist.org. Downloaded on 14 June 2026.,10 October 2025,International Union for Conservation of Nature (IUCN) 2015. The IUCN Red List of Threatened Species. Version 2025-2. https://www.iucnredlist.org. Downloaded on 14 June 2026.,185952,self,Coryphopterus_thrix,en,en.wikipedia.org,https://en.wikipedia.org/wiki/Coryphopterus_thrix,https://www.wikidata.org/entity/Q1977042,https://commons.wikimedia.org/wiki/Special:FilePath/Coryphopterus%20thrix%20-%20pone.0010676.g168.png,149
185954,1794029,2010-03-01T00:00:00.000+00:00,2015,https://www.iucnredlist.org/species/185954/1794029,"Pezold, F., van Tassell, J., Tornabene, L., Aiken, K.A. & Bouchereau, J.-L. 2015. Coryphopterus eidolon. The IUCN Red List of Threatened Species 2015: e.T185954A1794029. Accessed on 29 June 2026.",Coryphopterus eidolon,Pallid Goby,VU,Unknown,,,,species,,[],ACTINOPTERYGII,MARINEFISH,VU,Fishes (not comprehensive),True,False,VU,-75.88603952778492,18.426549744666893,range_polygon,1,1,4,2,3,200,0.999379775530718,1,Extant,1,Resident,185954,self,2399678.6521787695,2398190.3127602744,2398190.3127602744,,MARINEFISH_PART1.shp,International Union for Conservation of Nature (IUCN),2015,IUCN 2025. The IUCN Red List of Threatened Species. Version 2025-2. https://www.iucnredlist.org. Downloaded on 14 June 2026.,10 October 2025,International Union for Conservation of Nature (IUCN) 2015. The IUCN Red List of Threatened Species. Version 2025-2. https://www.iucnredlist.org. Downloaded on 14 June 2026.,185954,self,Coryphopterus_eidolon,en,en.wikipedia.org,https://en.wikipedia.org/wiki/Coryphopterus_eidolon,https://www.wikidata.org/entity/Q2593539,https://commons.wikimedia.org/wiki/Special:FilePath/Coryphopterus%20eidolon%20-%20pone.0010676.g165.png,145
185955,1794160,2010-03-01T00:00:00.000+00:00,2015,https://www.iucnredlist.org/species/185955/1794160,"Pezold, F., van Tassell, J., Aiken, K.A., Tornabene, L. & Bouchereau, J.-L. 2015. Coryphopterus tortugae. The IUCN Red List of Threatened Species 2015: e.T185955A1794160. Accessed on 29 June 2026.",Coryphopterus tortugae,Patch-reef Goby,VU,Unknown,,,,species,,[],ACTINOPTERYGII,MARINEFISH,VU,Fishes (not comprehensive),True,False,VU,-76.88419898770523,23.384768442018313,range_polygon,1,1,4,1,4,200,1.0,1,Extant,1,Resident,185955,self,1622172.263490775,1622172.263490775,1622172.263490775,,MARINEFISH_PART2.shp,International Union for Conservation of Nature (IUCN),2015,IUCN 2025. The IUCN Red List of Threatened Species. Version 2025-2. https://www.iucnredlist.org. Downloaded on 14 June 2026.,10 October 2025,International Union for Conservation of Nature (IUCN) 2015. The IUCN Red List of Threatened Species. Version 2025-2. https://www.iucnredlist.org. Downloaded on 14 June 2026.,185955,self,Coryphopterus_tortugae,en,en.wikipedia.org,https://en.wikipedia.org/wiki/Coryphopterus_tortugae,https://www.wikidata.org/entity/Q2234759,https://commons.wikimedia.org/wiki/Special:FilePath/FMIB%2041093%20Ctenogobius%20tortugae%20Type.jpeg,126
185956,1794260,2011-03-22T00:00:00.000+00:00,2015,https://www.iucnredlist.org/species/185956/1794260,"Pezold, F., Tornabene, L., Aiken, K.A. & Bouchereau, J.-L. 2015. Coryphopterus venezuelae. The IUCN Red List of Threatened Species 2015: e.T185956A1794260. Accessed on 29 June 2026.",Coryphopterus venezuelae,Sand-canyon Goby,VU,Unknown,,,,species,,[],ACTINOPTERYGII,MARINEFISH,VU,Fishes (not comprehensive),True,False,VU,-65.74232217910733,10.7139926159739,range_polygon,1,1,9,2,8,200,0.9716818945016896,1,Extant,1,Resident,185956,self,1129452.6748861272,1097468.714883353,1097468.714883353,,MARINEFISH_PART3.shp,International Union for Conservation of Nature (IUCN),2015,IUCN 2025. The IUCN Red List of Threatened Species. Version 2025-2. https://www.iucnredlist.org. Downloaded on 14 June 2026.,10 October 2025,International Union for Conservation of Nature (IUCN) 2015. The IUCN Red List of Threatened Species. Version 2025-2. https://www.iucnredlist.org. Downloaded on 14 June 2026.,185956,self,Coryphopterus_venezuelae,en,en.wikipedia.org,https://en.wikipedia.org/wiki/Coryphopterus_venezuelae,https://www.wikidata.org/entity/Q3221609,,152
185958,1794593,2011-03-22T00:00:00.000+00:00,2015,https://www.iucnredlist.org/species/185958/1794593,"Pezold, F., van Tassell, J., Aiken, K.A., Tornabene, L. & Bouchereau, J.-L. 2015. Coryphopterus lipernes. The IUCN Red List of Threatened Species 2015: e.T185958A1794593. Accessed on 29 June 2026.",Coryphopterus lipernes,Peppermint Goby,VU,Unknown,,11151,,species,,[],ACTINOPTERYGII,MARINEFISH,VU,Fishes (not comprehensive),True,False,VU,-74.54507517691638,17.94214116705771,range_polygon,1,1,2,1,2,200,1.0,1,Extant,1,Resident,185958,self,2186203.063596095,2186203.063596095,2186203.063596095,,MARINEFISH_PART5.shp,International Union for Conservation of Nature (IUCN),2015,IUCN 2025. The IUCN Red List of Threatened Species. Version 2025-2. https://www.iucnredlist.org. Downloaded on 14 June 2026.,10 October 2025,International Union for Conservation of Nature (IUCN) 2015. The IUCN Red List of Threatened Species. Version 2025-2. https://www.iucnredlist.org. Downloaded on 14 June 2026.,185958,self,Coryphopterus_lipernes,en,en.wikipedia.org,https://en.wikipedia.org/wiki/Coryphopterus_lipernes,https://www.wikidata.org/entity/Q2583014,https://commons.wikimedia.org/wiki/Special:FilePath/Coryphopterus%20lipernes.jpg,148
185960,1794928,2011-03-22T00:00:00.000+00:00,2015,https://www.iucnredlist.org/species/185960/1794928,"Pezold, F., van Tassell, J., Aiken, K.A., Tornabene, L. & Bouchereau, J.-L. 2015. Coryphopterus personatus. The IUCN Red List of Threatened Species 2015: e.T185960A1794928. Accessed on 29 June 2026.",Coryphopterus personatus,Masked Goby,VU,Unknown,,,,species,,[],ACTINOPTERYGII,MARINEFISH,VU,Fishes (not comprehensive),True,False,VU,-76.03987416160157,18.247435524953417,range_polygon,1,1,3,2,2,200,0.9868834434612636,1,Extant,1,Resident,185960,self,2438445.362535145,2406461.3560708333,2406461.3560708333,,MARINEFISH_PART7.shp,International Union for Conservation of Nature (IUCN),2015,IUCN 2025. The IUCN Red List of Threatened Species. Version 2025-2. https://www.iucnredlist.org. Downloaded on 14 June 2026.,10 October 2025,International Union for Conservation of Nature (IUCN) 2015. The IUCN Red List of Threatened Species. Version 2025-2. https://www.iucnredlist.org. Downloaded on 14 June 2026.,185960,self,Coryphopterus_personatus,en,en.wikipedia.org,https://en.wikipedia.org/wiki/Coryphopterus_personatus,https://www.wikidata.org/entity/Q2064517,https://commons.wikimedia.org/wiki/Special:FilePath/Coryphopterus%20personatus.jpg,424
185961,1795161,2011-03-22T00:00:00.000+00:00,2015,https://www.iucnredlist.org/species/185961/1795161,"Pezold, F., van Tassell, J., Tornabene, L., Aiken, K.A. & Bouchereau, J.-L. 2015. Coryphopterus alloides. The IUCN Red List of Threatened Species 2015: e.T185961A1795161. Accessed on 29 June 2026.",Coryphopterus alloides,Barfin Goby,VU,Unknown,,5578,,species,,[],ACTINOPTERYGII,MARINEFISH,VU,Fishes (not comprehensive),True,False,VU,-72.98125858226103,20.354797001446713,range_polygon,1,1,8,3,5,200,0.9362048901764388,1,Extant,1,Resident,185961,self,1145620.2182926906,1072535.250650616,1072535.250650616,,MARINEFISH_PART8.shp,International Union for Conservation of Nature (IUCN),2015,IUCN 2025. The IUCN Red List of Threatened Species. Version 2025-2. https://www.iucnredlist.org. Downloaded on 14 June 2026.,10 October 2025,International Union for Conservation of Nature (IUCN) 2015. The IUCN Red List of Threatened Species. Version 2025-2. https://www.iucnredlist.org. Downloaded on 14 June 2026.,185961,self,Coryphopterus_alloides,en,en.wikipedia.org,https://en.wikipedia.org/wiki/Coryphopterus_alloides,https://www.wikidata.org/entity/Q2457443,,165
185977,1797817,2011-03-22T00:00:00.000+00:00,2015,https://www.iucnredlist.org/species/185977/1797817,"Pezold, F., van Tassell, J., Tornabene, L., Aiken, K.A. & Bouchereau, J.-L. 2015. Elacatinus atronasus. The IUCN Red List of Threatened Species 2015: e.T185977A1797817. Accessed on 29 June 2026.",Elacatinus atronasus,Exuma Goby,EN,Decreasing,,145,17205,species,,[],ACTINOPTERYGII,MARINEFISH,EN,Fishes (not comprehensive),True,False,EN,-75.98720927266176,24.248356399691893,range_polygon,1,1,9,1,9,200,1.0,1,Extant,1,Resident,185977,self,17733.928298577746,17733.928298577746,17733.928298577746,,MARINEFISH_PART1.shp,International Union for Conservation of Nature (IUCN),2015,IUCN 2025. The IUCN Red List of Threatened Species. Version 2025-2. https://www.iucnredlist.org. Downloaded on 14 June 2026.,10 October 2025,International Union for Conservation of Nature (IUCN) 2015. The IUCN Red List of Threatened Species. Version 2025-2. https://www.iucnredlist.org. Downloaded on 14 June 2026.,185977,self,Elacatinus_atronasus,en,en.wikipedia.org,https://en.wikipedia.org/wiki/Elacatinus_atronasus,https://www.wikidata.org/entity/Q785108,https://commons.wikimedia.org/wiki/Special:FilePath/Elacatinus%20atronasum.JPG,195
185979,1798027,2014-01-10T00:00:00.000+00:00,2015,https://www.iucnredlist.org/species/185979/1798027,"van Tassell, J., Aiken, K.A., Tornabene, L. & Pezold, F. 2015. Elacatinus jarocho. The IUCN Red List of Threatened Species 2015: e.T185979A1798027. Accessed on 29 June 2026.",Elacatinus jarocho,Jarocho Goby,EN,Unknown,,32,8409,species,,[],ACTINOPTERYGII,MARINEFISH,EN,Fishes (not comprehensive),True,False,EN,-96.36123781555182,20.49698062735576,range_polygon,1,1,1,1,1,200,1.0,1,Extant,1,Resident,185979,self,36003.9308236546,36003.9308236546,36003.9308236546,,MARINEFISH_PART4.shp,International Union for Conservation of Nature (IUCN),2015,IUCN 2025. The IUCN Red List of Threatened Species. Version 2025-2. https://www.iucnredlist.org. Downloaded on 14 June 2026.,10 October 2025,International Union for Conservation of Nature (IUCN) 2015. The IUCN Red List of Threatened Species. Version 2025-2. https://www.iucnredlist.org. Downloaded on 14 June 2026.,185979,self,Elacatinus_jarocho,es,es.wikipedia.org,https://es.wikipedia.org/wiki/Elacatinus_jarocho,https://www.wikidata.org/entity/Q2196760,https://commons.wikimedia.org/wiki/Special:FilePath/Elacatinus%20jarocho%20%2810.3897-zookeys.882.38449%29%20Figure%2010.jpg,95
185980,1798139,2010-03-01T00:00:00.000+00:00,2015,https://www.iucnredlist.org/species/185980/1798139,"van Tassell, J., Aiken, K.A. & Tornabene, L. 2015. Elacatinus prochilos. The IUCN Red List of Threatened Species 2015: e.T185980A1798139. Accessed on 29 June 2026.",Elacatinus prochilos,Broadstripe Goby,VU,Unknown,,2000,,species,,[],ACTINOPTERYGII,MARINEFISH,VU,Fishes (not comprehensive),True,False,VU,-61.160146715166974,15.077829246965464,range_polygon,1,1,4,2,3,200,0.962754002508898,1,Extant,1,Resident,185980,self,740472.4881244078,712892.8516894961,712892.8516894961,,MARINEFISH_PART5.shp,International Union for Conservation of Nature (IUCN),2015,IUCN 2025. The IUCN Red List of Threatened Species. Version 2025-2. https://www.iucnredlist.org. Downloaded on 14 June 2026.,10 October 2025,International Union for Conservation of Nature (IUCN) 2015. The IUCN Red List of Threatened Species. Version 2025-2. https://www.iucnredlist.org. Downloaded on 14 June 2026.,185980,self,Elacatinus_prochilos,es,es.wikipedia.org,https://es.wikipedia.org/wiki/Elacatinus_prochilos,https://www.wikidata.org/entity/Q2680328,https://commons.wikimedia.org/wiki/Special:FilePath/Elacatinus%20prochilos.JPG,47
186016,1804288,2011-03-24T00:00:00.000+00:00,2015,https://www.iucnredlist.org/species/186016/1804288,"van Tassell, J., Aiken, K.A. & Tornabene, L. 2015. Gobiosoma spilotum. The IUCN Red List of Threatened Species 2015: e.T186016A1804288. Accessed on 29 June 2026.",Gobiosoma spilotum,Isthmian Goby,EN,Decreasing,,21,306,species,,[],ACTINOPTERYGII,MARINEFISH,EN,Fishes (not comprehensive),True,False,EN,-79.89217051065859,9.501726330672932,range_polygon,1,1,1,1,1,200,1.0,1,Extant,1,Resident,186016,self,1142.3102945442065,1142.3102945442065,1142.3102945442065,,MARINEFISH_PART4.shp,International Union for Conservation of Nature (IUCN),2015,IUCN 2025. The IUCN Red List of Threatened Species. Version 2025-2. https://www.iucnredlist.org. Downloaded on 14 June 2026.,10 October 2025,International Union for Conservation of Nature (IUCN) 2015. The IUCN Red List of Threatened Species. Version 2025-2. https://www.iucnredlist.org. Downloaded on 14 June 2026.,186016,self,Gobiosoma_spilotum,es,es.wikipedia.org,https://es.wikipedia.org/wiki/Gobiosoma_spilotum,https://www.wikidata.org/entity/Q3754585,,38
188356,1863321,2021-08-01T01:00:00.000+01:00,2022,https://www.iucnredlist.org/species/188356/1863321,"Allen, G.R. 2022. Chrysiptera niger. The IUCN Red List of Threatened Species 2022: e.T188356A1863321. Accessed on 29 June 2026.",Chrysiptera niger,Black Damselfish,EN,Decreasing,,,200,species,,[],ACTINOPTERYGII,MARINEFISH,EN,Fishes (not comprehensive),True,False,EN,149.39531758386116,-9.001456897080994,range_polygon,1,1,1,1,1,200,1.0,1,Extant,1,Resident,188356,self,9535.820798390438,9535.820798390438,9535.820798390438,,MARINEFISH_PART9.shp,IUCN Marine Biodiversity Unit/GMSA,2021,IUCN 2025. The IUCN Red List of Threatened Species. Version 2025-2. https://www.iucnredlist.org. Downloaded on 14 June 2026.,10 October 2025,IUCN Marine Biodiversity Unit/GMSA 2021. The IUCN Red List of Threatened Species. Version 2025-2. https://www.iucnredlist.org. Downloaded on 14 June 2026.,188356,self,Chrysiptera_niger,es,es.wikipedia.org,https://es.wikipedia.org/wiki/Chrysiptera_niger,https://www.wikidata.org/entity/Q3754905,,46
188370,1865331,2023-08-17T01:00:00.000+01:00,2024,https://www.iucnredlist.org/species/188370/1865331,"Samaniego, B., Arceo, H., Cabasan, J.P., Santos, M. & Williams, J.T. 2024. Cheiloprion labiatus. The IUCN Red List of Threatened Species 2024: e.T188370A1865331. Accessed on 29 June 2026.",Cheiloprion labiatus,Biglip Damsel,VU,Decreasing,,,,species,,[],ACTINOPTERYGII,MARINEFISH,VU,Fishes (not comprehensive),True,False,VU,127.21127832974204,-2.092208692967682,range_polygon,1,1,45,1,45,200,1.0,1,Extant,1,Resident,188370,self,11330313.754637092,11330313.754637092,11330313.754637092,,MARINEFISH_PART2.shp,IUCN Marine Biodiversity Unit,2023,IUCN 2025. The IUCN Red List of Threatened Species. Version 2025-2. https://www.iucnredlist.org. Downloaded on 14 June 2026.,10 October 2025,IUCN Marine Biodiversity Unit 2023. The IUCN Red List of Threatened Species. Version 2025-2. https://www.iucnredlist.org. Downloaded on 14 June 2026.,188370,self,Big-lip_damselfish,en,en.wikipedia.org,https://en.wikipedia.org/wiki/Big-lip_damselfish,https://www.wikidata.org/entity/Q4043223,https://commons.wikimedia.org/wiki/Special:FilePath/Pomacentrus%20labiosus%20Day%2081.jpg,383
188386,1867359,2021-09-23T01:00:00.000+01:00,2022,https://www.iucnredlist.org/species/188386/1867359,"Allen, G.R., Arceo, H., Mutia, M.T.M., Muyot, F.B., Nañola, C.L. & Santos, M. 2022. Pomacentrus lepidogenys. The IUCN Red List of Threatened Species 2022: e.T188386A1867359. Accessed on 29 June 2026.",Pomacentrus lepidogenys,Scaly Damsel,NT,Decreasing,,,,species,,[],ACTINOPTERYGII,MARINEFISH,NT,Fishes (not comprehensive),True,False,NT,127.63376717537656,-1.7381532414213414,range_polygon,1,1,85,2,84,200,0.9983524399958476,1,Extant,1,Resident,188386,self,9275710.125740822,9260427.83672754,9260427.83672754,,MARINEFISH_PART5.shp,IUCN Marine Biodiversity Unit/GMSA,2021,IUCN 2025. The IUCN Red List of Threatened Species. Version 2025-2. https://www.iucnredlist.org. Downloaded on 14 June 2026.,10 October 2025,IUCN Marine Biodiversity Unit/GMSA 2021. The IUCN Red List of Threatened Species. Version 2025-2. https://www.iucnredlist.org. Downloaded on 14 June 2026.,188386,self,Pomacentrus_lepidogenys,de,de.wikipedia.org,https://de.wikipedia.org/wiki/Pomacentrus_lepidogenys,https://www.wikidata.org/entity/Q2123723,https://commons.wikimedia.org/wiki/Special:FilePath/Scaly%20damselfish%20%28Pomacentrus%20lepidogenys%29%20%2832304221842%29.jpg,53
188397,1868736,2010-11-15T00:00:00.000+00:00,2017,https://www.iucnredlist.org/species/188397/1868736,"Jenkins, A., Carpenter, K.E., Allen, G. & Yeeting, B. 2017. Altrichthys curatus. The IUCN Red List of Threatened Species 2017: e.T188397A1868736. Accessed on 29 June 2026.",Altrichthys curatus,,VU,Decreasing,,1300,36500,species,,[],ACTINOPTERYGII,MARINEFISH,VU,Fishes (not comprehensive),True,False,VU,120.0497103262366,11.376342392355642,range_polygon,1,1,1,1,1,200,1.0,1,Extant,1,Resident,188397,self,41786.49900074867,41786.49900074867,41786.49900074867,,MARINEFISH_PART5.shp,IUCN Marine Biodiversity Unit/GMSA,2016,IUCN 2025. The IUCN Red List of Threatened Species. Version 2025-2. https://www.iucnredlist.org. Downloaded on 14 June 2026.,10 October 2025,IUCN Marine Biodiversity Unit/GMSA 2016. The IUCN Red List of Threatened Species. Version 2025-2. https://www.iucnredlist.org. Downloaded on 14 June 2026.,188397,self,Altrichthys_curatus,es,es.wikipedia.org,https://es.wikipedia.org/wiki/Altrichthys_curatus,https://www.wikidata.org/entity/Q2420525,https://commons.wikimedia.org/wiki/Special:FilePath/Altrichthys%20curatus.jpg,52
188406,1870440,2021-08-01T01:00:00.000+01:00,2022,https://www.iucnredlist.org/species/188406/1870440,"Allen, G.R. 2022. Chrysiptera hemicyanea. The IUCN Red List of Threatened Species 2022: e.T188406A1870440. Accessed on 29 June 2026.",Chrysiptera hemicyanea,Azure Demoiselle,VU,Decreasing,,,,species,,[],ACTINOPTERYGII,MARINEFISH,VU,Fishes (not comprehensive),True,False,VU,126.30504022887592,-7.207163743525526,range_polygon,1,1,4,1,4,200,1.0,1,Extant,1,Resident,188406,self,1148301.223319091,1148301.223319091,1148301.223319091,,MARINEFISH_PART5.shp,IUCN Marine Biodiversity Unit/GMSA,2021,IUCN 2025. The IUCN Red List of Threatened Species. Version 2025-2. https://www.iucnredlist.org. Downloaded on 14 June 2026.,10 October 2025,IUCN Marine Biodiversity Unit/GMSA 2021. The IUCN Red List of Threatened Species. Version 2025-2. https://www.iucnredlist.org. Downloaded on 14 June 2026.,188406,self,Chrysiptera_hemicyanea,en,en.wikipedia.org,https://en.wikipedia.org/wiki/Chrysiptera_hemicyanea,https://www.wikidata.org/entity/Q794311,https://commons.wikimedia.org/wiki/Special:FilePath/Crysiptera%20hemicyanea.jpg,2580
188421,1872388,2024-07-02T01:00:00.000+01:00,2025,https://www.iucnredlist.org/species/188421/1872388,"Carvalho-Filho, A. 2025. Stegastes rocasensis. The IUCN Red List of Threatened Species 2025: e.T188421A1872388. Accessed on 29 June 2026.",Stegastes rocasensis,Rocas Gregory,EN,Decreasing,,86,45940,species,,[],ACTINOPTERYGII,MARINEFISH,EN,Fishes (not comprehensive),True,False,EN,-33.09113912649329,-3.8497101397111138,range_polygon,1,2,2,2,1,200,0.7100405152532012,1,Extant,1,Resident,188421,self,85203.79189625048,60498.14429954022,60498.14429954022,,MARINEFISH_PART9.shp,IUCN Marine Biodiversity Unit,2024,IUCN 2025. The IUCN Red List of Threatened Species. Version 2025-2. https://www.iucnredlist.org. Downloaded on 14 June 2026.,10 October 2025,IUCN Marine Biodiversity Unit 2024. The IUCN Red List of Threatened Species. Version 2025-2. https://www.iucnredlist.org. Downloaded on 14 June 2026.,188421,self,Stegastes_rocasensis,en,en.wikipedia.org,https://en.wikipedia.org/wiki/Stegastes_rocasensis,https://www.wikidata.org/entity/Q1869453,,189
188421,1872388,2024-07-02T01:00:00.000+01:00,2025,https://www.iucnredlist.org/species/188421/1872388,"Carvalho-Filho, A. 2025. Stegastes rocasensis. The IUCN Red List of Threatened Species 2025: e.T188421A1872388. Accessed on 29 June 2026.",Stegastes rocasensis,Rocas Gregory,EN,Decreasing,,86,45940,species,,[],ACTINOPTERYGII,MARINEFISH,EN,Fishes (not comprehensive),True,False,EN,-29.345625652566337,0.917033527127696,range_polygon,2,2,2,2,1,200,0.2899594847467988,1,Extant,1,Resident,188421,self,85203.79189625048,24705.647596710256,24705.647596710256,,MARINEFISH_PART9.shp,IUCN Marine Biodiversity Unit,2024,IUCN 2025. The IUCN Red List of Threatened Species. Version 2025-2. https://www.iucnredlist.org. Downloaded on 14 June 2026.,10 October 2025,IUCN Marine Biodiversity Unit 2024. The IUCN Red List of Threatened Species. Version 2025-2. https://www.iucnredlist.org. Downloaded on 14 June 2026.,188421,self,Stegastes_rocasensis,en,en.wikipedia.org,https://en.wikipedia.org/wiki/Stegastes_rocasensis,https://www.wikidata.org/entity/Q1869453,,189
188472,1880318,2010-11-15T00:00:00.000+00:00,2017,https://www.iucnredlist.org/species/188472/1880318,"Jenkins, A., Carpenter, K.E., Allen, G. & Yeeting, B. 2017. Altrichthys azurelineatus. The IUCN Red List of Threatened Species 2017: e.T188472A1880318. Accessed on 29 June 2026.",Altrichthys azurelineatus,Azure Damsel,VU,Decreasing,,1400,43400,species,,[],ACTINOPTERYGII,MARINEFISH,VU,Fishes (not comprehensive),True,False,VU,119.73522223981703,11.200182013218042,range_polygon,1,1,1,1,1,200,1.0,1,Extant,1,Resident,188472,self,50409.804076698594,50409.804076698594,50409.804076698594,,MARINEFISH_PART4.shp,IUCN Marine Biodiversity Unit/GMSA,2016,IUCN 2025. The IUCN Red List of Threatened Species. Version 2025-2. https://www.iucnredlist.org. Downloaded on 14 June 2026.,10 October 2025,IUCN Marine Biodiversity Unit/GMSA 2016. The IUCN Red List of Threatened Species. Version 2025-2. https://www.iucnredlist.org. Downloaded on 14 June 2026.,188472,self,Altrichthys_azurelineatus,es,es.wikipedia.org,https://es.wikipedia.org/wiki/Altrichthys_azurelineatus,https://www.wikidata.org/entity/Q2437454,https://commons.wikimedia.org/wiki/Special:FilePath/Altrichthys%20azurelineatus.jpg,55
188498,1884312,2021-08-01T01:00:00.000+01:00,2022,https://www.iucnredlist.org/species/188498/1884312,"Allen, G.R. 2022. Amphiprion mccullochi. The IUCN Red List of Threatened Species 2022: e.T188498A1884312. Accessed on 29 June 2026.",Amphiprion mccullochi,McCulloch's Anemonefish,VU,Decreasing,,,7832,species,,[],ACTINOPTERYGII,MARINEFISH,VU,Fishes (not comprehensive),True,False,VU,158.93871203027902,-29.16149041879956,range_polygon,1,1,2,1,2,200,1.0,1,Extant,1,Resident,188498,self,63956.05996992556,63956.05996992556,63956.05996992556,,MARINEFISH_PART6.shp,IUCN Marine Biodiversity Unit/GMSA,2021,IUCN 2025. The IUCN Red List of Threatened Species. Version 2025-2. https://www.iucnredlist.org. Downloaded on 14 June 2026.,10 October 2025,IUCN Marine Biodiversity Unit/GMSA 2021. The IUCN Red List of Threatened Species. Version 2025-2. https://www.iucnredlist.org. Downloaded on 14 June 2026.,188498,self,Amphiprion_mccullochi,en,en.wikipedia.org,https://en.wikipedia.org/wiki/Amphiprion_mccullochi,https://www.wikidata.org/entity/Q1852922,https://commons.wikimedia.org/wiki/Special:FilePath/Amphiprion%20mccullochi%20pareja.jpg,1414
188528,1888295,2010-11-15T00:00:00.000+00:00,2017,https://www.iucnredlist.org/species/188528/1888295,"Jenkins, A., Carpenter, K.E., Allen, G. & Yeeting, B. 2017. Amblyglyphidodon batunai. The IUCN Red List of Threatened Species 2017: e.T188528A1888295. Accessed on 29 June 2026.",Amblyglyphidodon batunai,Green Sergeant,VU,Decreasing,,,,species,,[],ACTINOPTERYGII,MARINEFISH,VU,Fishes (not comprehensive),True,False,VU,125.4812530202266,-2.2672154292588416,range_polygon,1,1,8,4,5,200,0.9780707949919156,1,Extant,1,Resident,188528,self,6310597.222732926,6172210.842512167,6172210.842512167,,MARINEFISH_PART3.shp,IUCN Marine Biodiversity Unit/GMSA,2016,IUCN 2025. The IUCN Red List of Threatened Species. Version 2025-2. https://www.iucnredlist.org. Downloaded on 14 June 2026.,10 October 2025,IUCN Marine Biodiversity Unit/GMSA 2016. The IUCN Red List of Threatened Species. Version 2025-2. https://www.iucnredlist.org. Downloaded on 14 June 2026.,188528,self,Amblyglyphidodon_batunai,es,es.wikipedia.org,https://es.wikipedia.org/wiki/Amblyglyphidodon_batunai,https://www.wikidata.org/entity/Q2518392,https://commons.wikimedia.org/wiki/Special:FilePath/Batuna%27s%20damselfish%20%28Amblyglyphidodon%20batunai%29%20%2840321712202%29.jpg,46
188541,1890343,2024-07-02T01:00:00.000+01:00,2025,https://www.iucnredlist.org/species/188541/1890343,"Carvalho-Filho, A. 2025. Stegastes trindadensis. The IUCN Red List of Threatened Species 2025: e.T188541A1890343. Accessed on 29 June 2026.",Stegastes trindadensis,Trindade Gregory,EN,Decreasing,,48,20818,species,,[],ACTINOPTERYGII,MARINEFISH,EN,Fishes (not comprehensive),True,False,EN,-29.096295859059538,-20.487430279194097,range_polygon,1,2,2,2,1,200,0.6820969393070982,1,Extant,1,Resident,188541,self,58479.68064178661,39888.81117741921,39888.81117741921,,MARINEFISH_PART5.shp,IUCN Marine Biodiversity Unit,2024,IUCN 2025. The IUCN Red List of Threatened Species. Version 2025-2. https://www.iucnredlist.org. Downloaded on 14 June 2026.,10 October 2025,IUCN Marine Biodiversity Unit 2024. The IUCN Red List of Threatened Species. Version 2025-2. https://www.iucnredlist.org. Downloaded on 14 June 2026.,188541,self,Stegastes_trindadensis,es,es.wikipedia.org,https://es.wikipedia.org/wiki/Stegastes_trindadensis,https://www.wikidata.org/entity/Q2620385,,4
