taxonid,assessment_id,assessment_date,year_published,iucn_assessment_url,iucn_citation,scientific_name,main_common_name,category,population_trend,number_of_mature_individuals,estimated_area_of_occupancy,estimated_extent_of_occurrence,taxon_rank,parent_taxonid,child_infrarank_taxonids,taxon_class,spatial_package,spatial_category,taxon_group,iucn_has_ranges,iucn_has_points,category_iucn,lon,lat,centroid_source,centroid_rank,centroid_count,range_component_count,range_cluster_count,range_cluster_component_count,range_cluster_buffer_km,range_cluster_area_share,spatial_presence,spatial_presence_label,spatial_seasonal,spatial_seasonal_label,spatial_lookup_taxonid,spatial_lookup_source,computed_range_area_km2,computed_range_component_area_km2,range_component_area_km2,observation_point_count,source_paths,spatial_citation,spatial_year,iucn_dataset_citation,iucn_data_last_updated,spatial_credit
2539,97664057,2011-06-06T01:00:00.000+01:00,2015,https://www.iucnredlist.org/species/2539/97664057,"Liu, J., Zapfe, G., Shao, K.-T., Leis, J.L., Matsuura, K., Hardy, G., Liu, M. & Tyler, J. 2015. Balistes vetula (errata version published in 2016). The IUCN Red List of Threatened Species 2015: e.T2539A97664057. Accessed on 29 June 2026.",Balistes vetula,Queen Triggerfish,NT,Decreasing,,,,species,,[],ACTINOPTERYGII,MARINEFISH,NT,Fishes (not comprehensive),True,False,NT,-61.13817382765677,14.975289348508262,range_polygon,1,2,44,6,35,200,0.7292079885735031,1,Extant,1,Resident,2539,self,6250681.978284018,4558047.232597134,4558047.232597134,,MARINEFISH_PART1.shp,International Union for the Conservation of Nature,2015,IUCN 2025. The IUCN Red List of Threatened Species. Version 2025-2. https://www.iucnredlist.org. Downloaded on 14 June 2026.,10 October 2025,International Union for the Conservation of Nature 2015. The IUCN Red List of Threatened Species. Version 2025-2. https://www.iucnredlist.org. Downloaded on 14 June 2026.
2539,97664057,2011-06-06T01:00:00.000+01:00,2015,https://www.iucnredlist.org/species/2539/97664057,"Liu, J., Zapfe, G., Shao, K.-T., Leis, J.L., Matsuura, K., Hardy, G., Liu, M. & Tyler, J. 2015. Balistes vetula (errata version published in 2016). The IUCN Red List of Threatened Species 2015: e.T2539A97664057. Accessed on 29 June 2026.",Balistes vetula,Queen Triggerfish,NT,Decreasing,,,,species,,[],ACTINOPTERYGII,MARINEFISH,NT,Fishes (not comprehensive),True,False,NT,-24.20560795260424,16.00156115161301,range_polygon,2,2,44,6,4,200,0.2304816815900404,1,Extant,1,Resident,2539,self,6250681.978284018,1440667.6934394608,1440667.6934394608,,MARINEFISH_PART1.shp,International Union for the Conservation of Nature,2015,IUCN 2025. The IUCN Red List of Threatened Species. Version 2025-2. https://www.iucnredlist.org. Downloaded on 14 June 2026.,10 October 2025,International Union for the Conservation of Nature 2015. The IUCN Red List of Threatened Species. Version 2025-2. https://www.iucnredlist.org. Downloaded on 14 June 2026.
2621,21912374,2014-07-15T01:00:00.000+01:00,2015,https://www.iucnredlist.org/species/2621/21912374,"Carpenter, K.E., Smith-Vaniz, W.F., de Bruyne, G. & de Morais, L. 2015. Bathygobius burtoni. The IUCN Red List of Threatened Species 2015: e.T2621A21912374. Accessed on 29 June 2026.",Bathygobius burtoni,,EN,Unknown,,150,,species,,[],ACTINOPTERYGII,MARINEFISH,EN,Fishes (not comprehensive),True,False,EN,6.906264054525461,0.8594970690398633,range_polygon,1,1,3,2,2,200,0.8529904961557314,1,Extant,1,Resident,2621,self,130293.27943395654,111138.92907012795,111138.92907012795,,MARINEFISH_PART3.shp,International Union for Conservation of Nature,2015,IUCN 2025. The IUCN Red List of Threatened Species. Version 2025-2. https://www.iucnredlist.org. Downloaded on 14 June 2026.,10 October 2025,International Union for Conservation of Nature 2015. The IUCN Red List of Threatened Species. Version 2025-2. https://www.iucnredlist.org. Downloaded on 14 June 2026.
2958,121210485,2018-04-30T01:00:00.000+01:00,2020,https://www.iucnredlist.org/species/2958/121210485,"Edgar, G., Stuart-Smith, R. & Last, P.R. 2020. Brachionichthys hirsutus. The IUCN Red List of Threatened Species 2020: e.T2958A121210485. Accessed on 29 June 2026.",Brachionichthys hirsutus,Spotted Handfish,CR,Decreasing,950,36,58,species,,[],ACTINOPTERYGII,MARINEFISH,CR,Fishes (not comprehensive),True,False,CR,147.39533913718827,-42.96962988516051,range_polygon,1,1,1,1,1,200,1.0,1,Extant,1,Resident,2958,self,153.2632003647482,153.2632003647482,153.2632003647482,,MARINEFISH_PART3.shp,International Union for Conservation of Nature,2019,IUCN 2025. The IUCN Red List of Threatened Species. Version 2025-2. https://www.iucnredlist.org. Downloaded on 14 June 2026.,10 October 2025,International Union for Conservation of Nature 2019. The IUCN Red List of Threatened Species. Version 2025-2. https://www.iucnredlist.org. Downloaded on 14 June 2026.
3764,2867119,2011-06-08T01:00:00.000+01:00,2014,https://www.iucnredlist.org/species/3764/2867119,"Shao, K., Leis, J.L., Harwell, H., Jing, L., Matsuura, K. & Hardy, G. 2014. Canthigaster rapaensis. The IUCN Red List of Threatened Species 2014: e.T3764A2867119. Accessed on 29 June 2026.",Canthigaster rapaensis,,EN,Unknown,,28,34179.124,species,,[],ACTINOPTERYGII,MARINEFISH,EN,Fishes (not comprehensive),True,False,EN,-135.0000000000054,-23.108806596089728,range_polygon,1,2,2,2,1,200,0.52033182655938,1,Extant,1,Resident,3764,self,70802.52677489052,36840.8080817982,36840.8080817982,,MARINEFISH_PART6.shp,International Union for Conservation of Nature,2014,IUCN 2025. The IUCN Red List of Threatened Species. Version 2025-2. https://www.iucnredlist.org. Downloaded on 14 June 2026.,10 October 2025,International Union for Conservation of Nature 2014. The IUCN Red List of Threatened Species. Version 2025-2. https://www.iucnredlist.org. Downloaded on 14 June 2026.
3764,2867119,2011-06-08T01:00:00.000+01:00,2014,https://www.iucnredlist.org/species/3764/2867119,"Shao, K., Leis, J.L., Harwell, H., Jing, L., Matsuura, K. & Hardy, G. 2014. Canthigaster rapaensis. The IUCN Red List of Threatened Species 2014: e.T3764A2867119. Accessed on 29 June 2026.",Canthigaster rapaensis,,EN,Unknown,,28,34179.124,species,,[],ACTINOPTERYGII,MARINEFISH,EN,Fishes (not comprehensive),True,False,EN,-143.8601373952348,-27.617645250683033,range_polygon,2,2,2,2,1,200,0.4796681734406199,1,Extant,1,Resident,3764,self,70802.52677489052,33961.71869309232,33961.71869309232,,MARINEFISH_PART6.shp,International Union for Conservation of Nature,2014,IUCN 2025. The IUCN Red List of Threatened Species. Version 2025-2. https://www.iucnredlist.org. Downloaded on 14 June 2026.,10 October 2025,International Union for Conservation of Nature 2014. The IUCN Red List of Threatened Species. Version 2025-2. https://www.iucnredlist.org. Downloaded on 14 June 2026.
10097,148035632,2021-02-12T00:00:00.000+00:00,2022,https://www.iucnredlist.org/species/10097/148035632,"Cadrin, S., González Troncoso, D., Hallfredsson, E. & Munroe, T.A. 2022. Hippoglossus hippoglossus. The IUCN Red List of Threatened Species 2022: e.T10097A148035632. Accessed on 29 June 2026.",Hippoglossus hippoglossus,Atlantic Halibut,NT,Decreasing,,,,species,,[],ACTINOPTERYGII,MARINEFISH,NT,Fishes (not comprehensive),True,False,NT,-9.28650813369434,62.44963280683582,range_polygon,1,1,183,2,182,200,0.9999989960618452,1,Extant,1,Resident,10097,self,6200149.171283959,6200142.94671764,6200142.94671764,,MARINEFISH_PART9.shp,IUCN Marine Biodiversity Unit/GMSA,2021,IUCN 2025. The IUCN Red List of Threatened Species. Version 2025-2. https://www.iucnredlist.org. Downloaded on 14 June 2026.,10 October 2025,IUCN Marine Biodiversity Unit/GMSA 2021. The IUCN Red List of Threatened Species. Version 2025-2. https://www.iucnredlist.org. Downloaded on 14 June 2026.
13145,512306,2014-01-07T00:00:00.000+00:00,2015,https://www.iucnredlist.org/species/13145/512306,"Collette, B., Grubbs, D., Pezold, F., Simons, J., Caruso, J., Carlson, J., McEachran, J.D., Brenner, J., Tornabene, L., Chakrabarty, P., Robertson, R., Chao, L., Vega-Cendejas, M., Tolan, J., Carpenter, K.E., Munroe, T., Jelks, H. & Espinosa-Perez, H. 2015. Menidia conchorum. The IUCN Red List of Threatened Species 2015: e.T13145A512306. Accessed on 29 June 2026.",Menidia conchorum,Key Silverside,EN,Decreasing,,499,3802,species,,[],ACTINOPTERYGII,MARINEFISH,EN,Fishes (not comprehensive),True,False,EN,-81.16135749702174,24.757106115204067,range_polygon,1,1,1,1,1,200,1.0,1,Extant,1,Resident,13145,self,4135.651683602381,4135.651683602381,4135.651683602381,,MARINEFISH_PART4.shp,International Union for Conservation of Nature,2015,IUCN 2025. The IUCN Red List of Threatened Species. Version 2025-2. https://www.iucnredlist.org. Downloaded on 14 June 2026.,10 October 2025,International Union for Conservation of Nature 2015. The IUCN Red List of Threatened Species. Version 2025-2. https://www.iucnredlist.org. Downloaded on 14 June 2026.
15184,217446244,2022-09-13T01:00:00.000+01:00,2023,https://www.iucnredlist.org/species/15184/217446244,"Bensted-Smith, W., Brandt, M., Domínguez, O., Espinoza, E., Grove, J.S., Keith, I., Rivera, F.E., Suárez, J., Tapia, I. & Tirado-Sánchez, N. 2023. Ogilbia galapagosensis. The IUCN Red List of Threatened Species 2023: e.T15184A217446244. Accessed on 29 June 2026.",Ogilbia galapagosensis,Galápagos Cuskeel,EN,Decreasing,,16-500,600-1050,species,,[],ACTINOPTERYGII,MARINEFISH,EN,Fishes (not comprehensive),True,False,EN,-90.36609473802474,-0.7546837500399874,range_polygon,1,1,1,1,1,200,1.0,1,Extant,1,Resident,15184,self,37.17077409000443,37.17077409000443,37.17077409000443,,MARINEFISH_PART5.shp,IUCN Marine Biodiversity Unit,2022,IUCN 2025. The IUCN Red List of Threatened Species. Version 2025-2. https://www.iucnredlist.org. Downloaded on 14 June 2026.,10 October 2025,IUCN Marine Biodiversity Unit 2022. The IUCN Red List of Threatened Species. Version 2025-2. https://www.iucnredlist.org. Downloaded on 14 June 2026.
17710,162705687,2021-02-12T00:00:00.000+00:00,2022,https://www.iucnredlist.org/species/17710/162705687,"Cadrin, S., Siskey, M. & Munroe, T.A. 2022. Myzopsetta ferruginea. The IUCN Red List of Threatened Species 2022: e.T17710A162705687. Accessed on 29 June 2026.",Myzopsetta ferruginea,Yellowtail Flounder,VU,Decreasing,,,,species,,[],ACTINOPTERYGII,MARINEFISH,VU,Fishes (not comprehensive),True,False,VU,-60.14934942123585,46.78432009665889,range_polygon,1,1,33,1,33,200,1.0,1,Extant,1,Resident,17710,self,1113232.5152981626,1113232.5152981626,1113232.5152981626,,MARINEFISH_PART4.shp,IUCN Marine Biodiversity Unit/GMSA,2021,IUCN 2025. The IUCN Red List of Threatened Species. Version 2025-2. https://www.iucnredlist.org. Downloaded on 14 June 2026.,10 October 2025,IUCN Marine Biodiversity Unit/GMSA 2021. The IUCN Red List of Threatened Species. Version 2025-2. https://www.iucnredlist.org. Downloaded on 14 June 2026.
19896,177143139,2012-08-21T01:00:00.000+01:00,2020,https://www.iucnredlist.org/species/19896/177143139,"Collette, B., Aiken, K.A. & Polanco Fernandez, A. 2020. Sanopus astrifer (amended version of 2015 assessment). The IUCN Red List of Threatened Species 2020: e.T19896A177143139. Accessed on 29 June 2026.",Sanopus astrifer,Whitespotted Toadfish,VU,Unknown,,700,11218,species,,[],ACTINOPTERYGII,MARINEFISH,VU,Fishes (not comprehensive),True,False,VU,-87.84595884800761,17.147343071012838,range_polygon,1,1,1,1,1,200,1.0,1,Extant,1,Resident,19896,self,15778.093101981636,15778.093101981636,15778.093101981636,,MARINEFISH_PART4.shp,International Union for Conservation of Nature,2015,IUCN 2025. The IUCN Red List of Threatened Species. Version 2025-2. https://www.iucnredlist.org. Downloaded on 14 June 2026.,10 October 2025,International Union for Conservation of Nature 2015. The IUCN Red List of Threatened Species. Version 2025-2. https://www.iucnredlist.org. Downloaded on 14 June 2026.
19897,16643885,2012-08-21T01:00:00.000+01:00,2015,https://www.iucnredlist.org/species/19897/16643885,"Aiken, K.A., Collette, B. & Polanco Fernandez, A. 2015. Sanopus greenfieldorum. The IUCN Red List of Threatened Species 2015: e.T19897A16643885. Accessed on 29 June 2026.",Sanopus greenfieldorum,Whitelined Toadfish,VU,Unknown,,705,10484,species,,[],ACTINOPTERYGII,MARINEFISH,VU,Fishes (not comprehensive),True,False,VU,-87.88040870381354,17.004023995544554,range_polygon,1,1,1,1,1,200,1.0,1,Extant,1,Resident,19897,self,14000.15381020155,14000.15381020155,14000.15381020155,,MARINEFISH_PART6.shp,International Union for Conservation of Nature,2015,IUCN 2025. The IUCN Red List of Threatened Species. Version 2025-2. https://www.iucnredlist.org. Downloaded on 14 June 2026.,10 October 2025,International Union for Conservation of Nature 2015. The IUCN Red List of Threatened Species. Version 2025-2. https://www.iucnredlist.org. Downloaded on 14 June 2026.
19898,2547481,2014-01-09T00:00:00.000+00:00,2015,https://www.iucnredlist.org/species/19898/2547481,"Collette, B.B., Robertson, R., Tornabene, L., Chakrabarty, P., Grubbs, D., Simons, J., Brenner, J., Caruso, J., McEachran, J.D., Pezold, F., Carlson, J., Espinosa-Perez, H. & Vega-Cendejas, M. 2015. Sanopus reticulatus. The IUCN Red List of Threatened Species 2015: e.T19898A2547481. Accessed on 29 June 2026.",Sanopus reticulatus,Reticulated Toadfish,EN,Unknown,,,4386,species,,[],ACTINOPTERYGII,MARINEFISH,EN,Fishes (not comprehensive),True,False,EN,-90.08164584743392,21.338319822826076,range_polygon,1,1,1,1,1,200,1.0,1,Extant,1,Resident,19898,self,3764.4230642561324,3764.4230642561324,3764.4230642561324,,MARINEFISH_PART1.shp,International Union for Conservation of Nature,2015,IUCN 2025. The IUCN Red List of Threatened Species. Version 2025-2. https://www.iucnredlist.org. Downloaded on 14 June 2026.,10 October 2025,International Union for Conservation of Nature 2015. The IUCN Red List of Threatened Species. Version 2025-2. https://www.iucnredlist.org. Downloaded on 14 June 2026.
19899,16643913,2012-08-21T01:00:00.000+01:00,2015,https://www.iucnredlist.org/species/19899/16643913,"Collette, B., Aiken, K.A. & Polanco Fernandez, A. 2015. Sanopus splendidus. The IUCN Red List of Threatened Species 2015: e.T19899A16643913. Accessed on 29 June 2026.",Sanopus splendidus,Splendid Toadfish,EN,Unknown,,109,9552,species,,[],ACTINOPTERYGII,MARINEFISH,EN,Fishes (not comprehensive),True,False,EN,-87.78329896347017,16.795417569861492,range_polygon,1,1,2,1,2,200,1.0,1,Extant,1,Resident,19899,self,3730.0272393055,3730.0272393055,3730.0272393055,,MARINEFISH_PART4.shp,International Union for Conservation of Nature,2015,IUCN 2025. The IUCN Red List of Threatened Species. Version 2025-2. https://www.iucnredlist.org. Downloaded on 14 June 2026.,10 October 2025,International Union for Conservation of Nature 2015. The IUCN Red List of Threatened Species. Version 2025-2. https://www.iucnredlist.org. Downloaded on 14 June 2026.
154699,238341558,2024-03-19T00:00:00.000+00:00,2025,https://www.iucnredlist.org/species/154699/238341558,"Jaafar, Z., Carpenter, K.E., Dinh Minh, Q. & Williams, J.T. 2025. Mugilogobius fasciatus. The IUCN Red List of Threatened Species 2025: e.T154699A238341558. Accessed on 29 June 2026.",Mugilogobius fasciatus,,NT,Decreasing,,2268,106946,species,,[],ACTINOPTERYGII,MARINEFISH,NT,Fishes (not comprehensive),True,False,NT,99.94334138290489,5.284444739804946,range_polygon,1,1,1,1,1,200,1.0,1,Extant,1,Resident,154699,self,85141.15170840536,85141.15170840536,85141.15170840536,,MARINEFISH_PART4.shp,IUCN Marine Biodiversity Unit,2024,IUCN 2025. The IUCN Red List of Threatened Species. Version 2025-2. https://www.iucnredlist.org. Downloaded on 14 June 2026.,10 October 2025,IUCN Marine Biodiversity Unit 2024. The IUCN Red List of Threatened Species. Version 2025-2. https://www.iucnredlist.org. Downloaded on 14 June 2026.
154700,4610380,2009-02-04T00:00:00.000+00:00,2010,https://www.iucnredlist.org/species/154700/4610380,"Fricke, R., McEachran, J. & Williams, J.T. 2010. Enneapterygius namarrgon. The IUCN Red List of Threatened Species 2010: e.T154700A4610380. Accessed on 29 June 2026.",Enneapterygius namarrgon,Lightning Man Triplefin,EN,Unknown,,,317,species,,[],ACTINOPTERYGII,MARINEFISH,EN,Fishes (not comprehensive),True,False,EN,137.0926016235711,-12.717698831972092,range_polygon,1,1,1,1,1,200,1.0,1,Extant,1,Resident,154700,self,172172.88912622005,172172.88912622005,172172.88912622005,,MARINEFISH_PART5.shp,International Union for Conservation of Nature,2014,IUCN 2025. The IUCN Red List of Threatened Species. Version 2025-2. https://www.iucnredlist.org. Downloaded on 14 June 2026.,10 October 2025,International Union for Conservation of Nature 2014. The IUCN Red List of Threatened Species. Version 2025-2. https://www.iucnredlist.org. Downloaded on 14 June 2026.
154717,46921747,2015-04-20T01:00:00.000+01:00,2015,https://www.iucnredlist.org/species/154717/46921747,"Munroe, T. & Tyler, J. 2015. Anchoa choerostoma. The IUCN Red List of Threatened Species 2015: e.T154717A46921747. Accessed on 29 June 2026.",Anchoa choerostoma,Bermuda Anchovy,EN,Unknown,,220,867,species,,[],ACTINOPTERYGII,MARINEFISH,EN,Fishes (not comprehensive),True,False,EN,-64.77484702104927,32.32118600381693,range_polygon,1,1,1,1,1,200,1.0,1,Extant,1,Resident,154717,self,31992.44281106099,31992.44281106099,31992.44281106099,,MARINEFISH_PART7.shp,International Union for Conservation of Nature,2015,IUCN 2025. The IUCN Red List of Threatened Species. Version 2025-2. https://www.iucnredlist.org. Downloaded on 14 June 2026.,10 October 2025,International Union for Conservation of Nature 2015. The IUCN Red List of Threatened Species. Version 2025-2. https://www.iucnredlist.org. Downloaded on 14 June 2026.
154724,115227856,2007-05-24T01:00:00.000+01:00,2010,https://www.iucnredlist.org/species/154724/115227856,"Moore, J.A., Allen, G.R. & Robertson, R.D. 2010. Myripristis clarionensis (errata version published in 2017). The IUCN Red List of Threatened Species 2010: e.T154724A115227856. Accessed on 29 June 2026.",Myripristis clarionensis,Candil Amarillo,VU,Unknown,,50,,species,,[],ACTINOPTERYGII,MARINEFISH,VU,Fishes (not comprehensive),True,False,VU,-112.62432932610136,18.661780697058422,range_polygon,1,1,2,2,1,200,0.9388138266781046,1,Extant,1,Resident,154724,self,71687.36757160342,67301.09187437687,67301.09187437687,,MARINEFISH_PART4.shp,Sampled Red List Index,2010,IUCN 2025. The IUCN Red List of Threatened Species. Version 2025-2. https://www.iucnredlist.org. Downloaded on 14 June 2026.,10 October 2025,Sampled Red List Index 2010. The IUCN Red List of Threatened Species. Version 2025-2. https://www.iucnredlist.org. Downloaded on 14 June 2026.
154738,4622426,2009-01-27T00:00:00.000+00:00,2010,https://www.iucnredlist.org/species/154738/4622426,"Acero, A. & Fricke, R. 2010. Callionymus comptus. The IUCN Red List of Threatened Species 2010: e.T154738A4622426. Accessed on 29 June 2026.",Callionymus comptus,Ornamented Dragonet,VU,Unknown,,,1-20000,species,,[],ACTINOPTERYGII,MARINEFISH,VU,Fishes (not comprehensive),True,False,VU,-156.27910100235428,20.506605134301246,range_polygon,1,1,7,1,7,200,1.0,1,Extant,1,Resident,154738,self,12122.286125270668,12122.286125270668,12122.286125270668,,MARINEFISH_PART2.shp,International Union for Conservation of Nature (IUCN),2012,IUCN 2025. The IUCN Red List of Threatened Species. Version 2025-2. https://www.iucnredlist.org. Downloaded on 14 June 2026.,10 October 2025,International Union for Conservation of Nature (IUCN) 2012. The IUCN Red List of Threatened Species. Version 2025-2. https://www.iucnredlist.org. Downloaded on 14 June 2026.
154748,115229991,2009-01-28T00:00:00.000+00:00,2010,https://www.iucnredlist.org/species/154748/115229991,"Dooley, J., Matsuura, K., Collette, B., Nelson, J., Fritzsche, R. & Carpenter, K. 2010. Lophius vomerinus (errata version published in 2017). The IUCN Red List of Threatened Species 2010: e.T154748A115229991. Accessed on 29 June 2026.",Lophius vomerinus,Cape Monk,NT,Unknown,,,,species,,[],ACTINOPTERYGII,MARINEFISH,NT,Fishes (not comprehensive),True,False,NT,15.407598724749693,-28.828536385659852,range_polygon,1,1,1,1,1,200,1.0,1,Extant,1,Resident,154748,self,283566.0670623888,283566.0670623888,283566.0670623888,,MARINEFISH_PART7.shp,Sampled Red List Index,2010,IUCN 2025. The IUCN Red List of Threatened Species. Version 2025-2. https://www.iucnredlist.org. Downloaded on 14 June 2026.,10 October 2025,Sampled Red List Index 2010. The IUCN Red List of Threatened Species. Version 2025-2. https://www.iucnredlist.org. Downloaded on 14 June 2026.
154763,4628251,2007-05-23T01:00:00.000+01:00,2010,https://www.iucnredlist.org/species/154763/4628251,"Hastings, P. & Dominici-Arosemena, A. 2010. Axoclinus multicinctus. The IUCN Red List of Threatened Species 2010: e.T154763A4628251. Accessed on 29 June 2026.",Axoclinus multicinctus,Multibarred Triplefin,VU,Unknown,,,,species,,[],ACTINOPTERYGII,MARINEFISH,VU,Fishes (not comprehensive),True,False,VU,-110.87668471423375,19.016537219883915,range_polygon,1,1,1,1,1,200,1.0,1,Extant,1,Resident,154763,self,44615.80880524457,44615.80880524457,44615.80880524457,,MARINEFISH_PART3.shp,International Union for Conservation of Nature,2014,IUCN 2025. The IUCN Red List of Threatened Species. Version 2025-2. https://www.iucnredlist.org. Downloaded on 14 June 2026.,10 October 2025,International Union for Conservation of Nature 2014. The IUCN Red List of Threatened Species. Version 2025-2. https://www.iucnredlist.org. Downloaded on 14 June 2026.
154783,4632618,2009-01-27T00:00:00.000+00:00,2010,https://www.iucnredlist.org/species/154783/4632618,"Nelson, J., Neely, C., Matsuura, K., Collette, B., Dooley, J., Fritzsche, R. & Carpenter, K. 2010. Artedielloides auriculatus. The IUCN Red List of Threatened Species 2010: e.T154783A4632618. Accessed on 29 June 2026.",Artedielloides auriculatus,,NT,Unknown,,,,species,,[],ACTINOPTERYGII,MARINEFISH,NT,Fishes (not comprehensive),True,False,NT,131.87206815226867,42.837653194034644,range_polygon,1,1,1,1,1,200,1.0,1,Extant,1,Resident,154783,self,5770.373895035741,5770.373895035741,5770.373895035741,,MARINEFISH_PART2.shp,International Union for Conservation of Nature (IUCN),2012,IUCN 2025. The IUCN Red List of Threatened Species. Version 2025-2. https://www.iucnredlist.org. Downloaded on 14 June 2026.,10 October 2025,International Union for Conservation of Nature (IUCN) 2012. The IUCN Red List of Threatened Species. Version 2025-2. https://www.iucnredlist.org. Downloaded on 14 June 2026.
154874,238338060,2024-03-21T00:00:00.000+00:00,2025,https://www.iucnredlist.org/species/154874/238338060,"Williams, J.T., Vukić, J., Šanda, R. & Conway, K.W. 2025. Hetereleotris georgegilli. The IUCN Red List of Threatened Species 2025: e.T154874A238338060. Accessed on 29 June 2026.",Hetereleotris georgegilli,Gill's Goby,NT,Decreasing,,876,60799,species,,[],ACTINOPTERYGII,MARINEFISH,NT,Fishes (not comprehensive),True,False,NT,58.362684216114765,-20.44274484954172,range_polygon,1,1,2,1,2,200,1.0,1,Extant,1,Resident,154874,self,126278.13505338946,126278.13505338946,126278.13505338946,,MARINEFISH_PART4.shp,IUCN Marine Biodiversity Unit,2024,IUCN 2025. The IUCN Red List of Threatened Species. Version 2025-2. https://www.iucnredlist.org. Downloaded on 14 June 2026.,10 October 2025,IUCN Marine Biodiversity Unit 2024. The IUCN Red List of Threatened Species. Version 2025-2. https://www.iucnredlist.org. Downloaded on 14 June 2026.
154957,4676936,2007-05-23T01:00:00.000+01:00,2010,https://www.iucnredlist.org/species/154957/4676936,"Dominici-Arosemena, A., Espinosa-Perez, H. & Hastings, P. 2010. Hypsoblennius striatus. The IUCN Red List of Threatened Species 2010: e.T154957A4676936. Accessed on 29 June 2026.",Hypsoblennius striatus,Striated Blenny,NT,Unknown,,"2,000",,species,,[],ACTINOPTERYGII,MARINEFISH,NT,Fishes (not comprehensive),True,False,NT,-82.20432092294084,8.06872025540774,range_polygon,1,1,1,1,1,200,1.0,1,Extant,1,Resident,154957,self,156696.42562571552,156696.42562571552,156696.42562571552,,MARINEFISH_PART2.shp,International Union for Conservation of Nature,2014,IUCN 2025. The IUCN Red List of Threatened Species. Version 2025-2. https://www.iucnredlist.org. Downloaded on 14 June 2026.,10 October 2025,International Union for Conservation of Nature 2014. The IUCN Red List of Threatened Species. Version 2025-2. https://www.iucnredlist.org. Downloaded on 14 June 2026.
154986,4683552,2007-05-25T01:00:00.000+01:00,2010,https://www.iucnredlist.org/species/154986/4683552,"McCosker, J., Hastings, P.A., Williams, J.T. & McEachran, J.D. 2010. Paraclinus magdalenae. The IUCN Red List of Threatened Species 2010: e.T154986A4683552. Accessed on 29 June 2026.",Paraclinus magdalenae,Magdalena Blenny,EN,Stable,,,1131,species,,[],ACTINOPTERYGII,MARINEFISH,EN,Fishes (not comprehensive),True,False,EN,-112.31028151662312,24.326792732805295,range_polygon,1,1,2,1,2,200,1.0,1,Extant,1,Resident,154986,self,11663.043334104566,11663.043334104566,11663.043334104566,,MARINEFISH_PART5.shp,International Union for Conservation of Nature,2014,IUCN 2025. The IUCN Red List of Threatened Species. Version 2025-2. https://www.iucnredlist.org. Downloaded on 14 June 2026.,10 October 2025,International Union for Conservation of Nature 2014. The IUCN Red List of Threatened Species. Version 2025-2. https://www.iucnredlist.org. Downloaded on 14 June 2026.
