taxonid,assessment_id,assessment_date,year_published,iucn_assessment_url,iucn_citation,scientific_name,main_common_name,category,population_trend,number_of_mature_individuals,estimated_area_of_occupancy,estimated_extent_of_occurrence,taxon_rank,parent_taxonid,child_infrarank_taxonids,taxon_class,spatial_package,spatial_category,taxon_group,iucn_has_ranges,iucn_has_points,category_iucn,lon,lat,centroid_source,centroid_rank,centroid_count,range_component_count,range_cluster_count,range_cluster_component_count,range_cluster_buffer_km,range_cluster_area_share,spatial_presence,spatial_presence_label,spatial_seasonal,spatial_seasonal_label,spatial_lookup_taxonid,spatial_lookup_source,computed_range_area_km2,computed_range_component_area_km2,range_component_area_km2,observation_point_count,source_paths,spatial_citation,spatial_year,iucn_dataset_citation,iucn_data_last_updated,spatial_credit
196674,143863981,2017-02-28T00:00:00.000+00:00,2018,https://www.iucnredlist.org/species/196674/143863981,"Caruso, J., Robertson, R., Munroe, T.A., Palla, H.P., Nanola, C., Arceo, H., Williams, J., Di Dario, F., Muallil, R. & Acosta, A.K.M. 2018. Neoopisthopterus cubanus (errata version published in 2019). The IUCN Red List of Threatened Species 2018: e.T196674A143863981. Accessed on 29 June 2026.",Neoopisthopterus cubanus,Cuban Longfin Herring,VU,Unknown,,1999,23595,species,,[],ACTINOPTERYGII,MARINEFISH,VU,Fishes (not comprehensive),True,False,VU,-83.58985471882947,23.05438154066966,range_polygon,1,1,2,1,2,200,1.0,1,Extant,1,Resident,196674,self,51770.477773152605,51770.477773152605,51770.477773152605,,MARINEFISH_PART2.shp,IUCN Marine Biodiversity Unit/GMSA,2018,IUCN 2025. The IUCN Red List of Threatened Species. Version 2025-2. https://www.iucnredlist.org. Downloaded on 14 June 2026.,10 October 2025,IUCN Marine Biodiversity Unit/GMSA 2018. The IUCN Red List of Threatened Species. Version 2025-2. https://www.iucnredlist.org. Downloaded on 14 June 2026.
196678,2473113,2014-01-09T00:00:00.000+00:00,2015,https://www.iucnredlist.org/species/196678/2473113,"Collette, B., Grubbs, D., Pezold, F., Simons, J., Caruso, J., Carlson, J., McEachran, J.D., Brenner, J., Tornabene, L., Chakrabarty, P., Robertson, R., Chao, L., Tolan, J., Vega-Cendejas, M., Espinosa-Perez, H. & Jelks, H. 2015. Fundulus jenkinsi. The IUCN Red List of Threatened Species 2015: e.T196678A2473113. Accessed on 29 June 2026.",Fundulus jenkinsi,Saltmarsh Topminnow,VU,Unknown,,1999,163078,species,,[],ACTINOPTERYGII,MARINEFISH,VU,Fishes (not comprehensive),True,False,VU,-91.5088208008758,29.269782092352703,range_polygon,1,1,9,1,9,200,1.0,1,Extant,1,Resident,196678,self,235499.7281773576,235499.7281773576,235499.7281773576,,MARINEFISH_PART4.shp,NatureServe,2015,IUCN 2025. The IUCN Red List of Threatened Species. Version 2025-2. https://www.iucnredlist.org. Downloaded on 14 June 2026.,10 October 2025,NatureServe 2015. The IUCN Red List of Threatened Species. Version 2025-2. https://www.iucnredlist.org. Downloaded on 14 June 2026.
198582,15543624,2014-07-23T01:00:00.000+01:00,2015,https://www.iucnredlist.org/species/198582/15543624,"Tous, P., Sidibé, A, Mbye, E., de Morais, L., Camara, K., Munroe, T., Adeofe, T.A., Camara, Y.H., Djiman, R., Sagna, A. & Sylla, M. 2015. Sardinella maderensis. The IUCN Red List of Threatened Species 2015: e.T198582A15543624. Accessed on 29 June 2026.",Sardinella maderensis,Madeiran Sardinella,VU,Unknown,,,,species,,[],ACTINOPTERYGII,MARINEFISH,VU,Fishes (not comprehensive),True,False,VU,-16.0933382809379,32.75283430948333,range_polygon,1,1,14,1,14,200,1.0,1,Extant,1,Resident,198582,self,2888791.604670145,2888791.604670145,2888791.604670145,,MARINEFISH_PART9.shp,International Union for Conservation of Nature,2015,IUCN 2025. The IUCN Red List of Threatened Species. Version 2025-2. https://www.iucnredlist.org. Downloaded on 14 June 2026.,10 October 2025,International Union for Conservation of Nature 2015. The IUCN Red List of Threatened Species. Version 2025-2. https://www.iucnredlist.org. Downloaded on 14 June 2026.
198647,43157137,2013-05-09T01:00:00.000+01:00,2015,https://www.iucnredlist.org/species/198647/43157137,"Smith-Vaniz, W.F., Sidibe, A., Nunoo, F., Lindeman, K., Williams, A.B., Quartey, R., Camara, K., Carpenter, K.E., Montiero, V., de Morais, L., Djiman, R., Sylla, M. & Sagna, A. 2015. Trachurus trachurus. The IUCN Red List of Threatened Species 2015: e.T198647A43157137. Accessed on 29 June 2026.",Trachurus trachurus,Atlantic Horse Mackerel,VU,Decreasing,,,,species,,[],ACTINOPTERYGII,MARINEFISH,VU,Fishes (not comprehensive),True,False,VU,-17.572474207922646,63.11889648271698,range_polygon,1,1,14,2,13,200,0.999998996217401,1,Extant,1,Resident,198647,self,9327094.521990804,9327085.159615623,9327085.159615623,,MARINEFISH_PART1.shp,International Union for Conservation of Nature,2015,IUCN 2025. The IUCN Red List of Threatened Species. Version 2025-2. https://www.iucnredlist.org. Downloaded on 14 June 2026.,10 October 2025,International Union for Conservation of Nature 2015. The IUCN Red List of Threatened Species. Version 2025-2. https://www.iucnredlist.org. Downloaded on 14 June 2026.
202019,2732047,2017-07-19T01:00:00.000+01:00,2020,https://www.iucnredlist.org/species/202019/2732047,"Larson, H. 2020. Acentrogobius griseus. The IUCN Red List of Threatened Species 2020: e.T202019A2732047. Accessed on 29 June 2026.",Acentrogobius griseus,Grey Goby,VU,Unknown,,2000,,species,,[],ACTINOPTERYGII,MARINEFISH,VU,Fishes (not comprehensive),True,False,VU,80.34778720624868,11.90841673665313,range_polygon,1,1,3,1,3,200,1.0,1,Extant,1,Resident,202019,self,68724.35965941021,68724.35965941021,68724.35965941021,,MARINEFISH_PART8.shp,IUCN Marine Biodiversity Unit/GMSA,2019,IUCN 2025. The IUCN Red List of Threatened Species. Version 2025-2. https://www.iucnredlist.org. Downloaded on 14 June 2026.,10 October 2025,IUCN Marine Biodiversity Unit/GMSA 2019. The IUCN Red List of Threatened Species. Version 2025-2. https://www.iucnredlist.org. Downloaded on 14 June 2026.
202038,2732189,2019-08-16T01:00:00.000+01:00,2020,https://www.iucnredlist.org/species/202038/2732189,"Nair, R., Munroe, T.A. & Weerts, S.P. 2020. Cynoglossus macrostomus. The IUCN Red List of Threatened Species 2020: e.T202038A2732189. Accessed on 29 June 2026.",Cynoglossus macrostomus,Malabar Tonguesole,VU,Unknown,,,,species,,[],ACTINOPTERYGII,MARINEFISH,VU,Fishes (not comprehensive),True,False,VU,73.60856850770125,14.74959706910579,range_polygon,1,1,2,1,2,200,1.0,1,Extant,1,Resident,202038,self,467650.42519148765,467650.42519148765,467650.42519148765,,MARINEFISH_PART6.shp,IUCN Marine Biodiversity Unit/GMSA,2020,IUCN 2025. The IUCN Red List of Threatened Species. Version 2025-2. https://www.iucnredlist.org. Downloaded on 14 June 2026.,10 October 2025,IUCN Marine Biodiversity Unit/GMSA 2020. The IUCN Red List of Threatened Species. Version 2025-2. https://www.iucnredlist.org. Downloaded on 14 June 2026.
202632,46958684,2015-06-12T01:00:00.000+01:00,2015,https://www.iucnredlist.org/species/202632/46958684,"Munroe, T. 2015. Paralichthys lethostigma. The IUCN Red List of Threatened Species 2015: e.T202632A46958684. Accessed on 29 June 2026.",Paralichthys lethostigma,Southern Flounder,NT,Decreasing,,,,species,,[],ACTINOPTERYGII,MARINEFISH,NT,Fishes (not comprehensive),True,False,NT,-80.01039638628188,31.961668921590658,range_polygon,1,1,4,1,4,200,1.0,1,Extant,1,Resident,202632,self,495225.22375066316,495225.22375066316,495225.22375066316,,MARINEFISH_PART8.shp,International Union for Conservation of Nature,2015,IUCN 2025. The IUCN Red List of Threatened Species. Version 2025-2. https://www.iucnredlist.org. Downloaded on 14 June 2026.,10 October 2025,International Union for Conservation of Nature 2015. The IUCN Red List of Threatened Species. Version 2025-2. https://www.iucnredlist.org. Downloaded on 14 June 2026.
15522149,15603540,2012-07-11T01:00:00.000+01:00,2015,https://www.iucnredlist.org/species/15522149/15603540,"Iwamoto, T. 2015. Coryphaenoides rupestris. The IUCN Red List of Threatened Species 2015: e.T15522149A15603540. Accessed on 29 June 2026.",Coryphaenoides rupestris,Roundnose Grenadier,CR,Unknown,,,,species,,[],ACTINOPTERYGII,MARINEFISH,CR,Fishes (not comprehensive),True,False,CR,-29.927053497549192,57.57890468983979,range_polygon,1,1,14,2,13,200,0.9985349009718317,1,Extant,1,Resident,15522149,self,4372842.69101901,4366436.043442065,4366436.043442065,,MARINEFISH_PART9.shp,International Union for Conservation of Nature,2015,IUCN 2025. The IUCN Red List of Threatened Species. Version 2025-2. https://www.iucnredlist.org. Downloaded on 14 June 2026.,10 October 2025,International Union for Conservation of Nature 2015. The IUCN Red List of Threatened Species. Version 2025-2. https://www.iucnredlist.org. Downloaded on 14 June 2026.
15522229,15603615,2012-07-12T01:00:00.000+01:00,2015,https://www.iucnredlist.org/species/15522229/15603615,"Iwamoto, T. 2015. Merluccius senegalensis. The IUCN Red List of Threatened Species 2015: e.T15522229A15603615. Accessed on 29 June 2026.",Merluccius senegalensis,Senegalese Hake,EN,Decreasing,,,,species,,[],ACTINOPTERYGII,MARINEFISH,EN,Fishes (not comprehensive),True,False,EN,-17.07107719548025,22.395825136884625,range_polygon,1,1,1,1,1,200,1.0,1,Extant,1,Resident,15522229,self,294072.66310608626,294072.66310608626,294072.66310608626,,MARINEFISH_PART2.shp,International Union for Conservation of Nature,2015,IUCN 2025. The IUCN Red List of Threatened Species. Version 2025-2. https://www.iucnredlist.org. Downloaded on 14 June 2026.,10 October 2025,International Union for Conservation of Nature 2015. The IUCN Red List of Threatened Species. Version 2025-2. https://www.iucnredlist.org. Downloaded on 14 June 2026.
15602438,15604015,2014-05-20T01:00:00.000+01:00,2015,https://www.iucnredlist.org/species/15602438/15604015,"Adeofe, T.A., Camara, K., Camara, Y.H., Cissoko, K., Djiman, R., Mbye, E., Munroe, T., Sidibe, A., Tous, P., de Morais, L., Sagna, A. & Sylla, M. 2015. Cynoglossus canariensis. The IUCN Red List of Threatened Species 2015: e.T15602438A15604015. Accessed on 29 June 2026.",Cynoglossus canariensis,Canary Tonguesole,NT,Stable,,,,species,,[],ACTINOPTERYGII,MARINEFISH,NT,Fishes (not comprehensive),True,False,NT,-24.236351140731276,16.022662149105706,range_polygon,1,1,8,1,8,200,1.0,1,Extant,1,Resident,15602438,self,1754706.593993492,1754706.593993492,1754706.593993492,,MARINEFISH_PART4.shp,International Union for Conservation of Nature,2015,IUCN 2025. The IUCN Red List of Threatened Species. Version 2025-2. https://www.iucnredlist.org. Downloaded on 14 June 2026.,10 October 2025,International Union for Conservation of Nature 2015. The IUCN Red List of Threatened Species. Version 2025-2. https://www.iucnredlist.org. Downloaded on 14 June 2026.
15602466,15604025,2013-08-17T01:00:00.000+01:00,2015,https://www.iucnredlist.org/species/15602466/15604025,"Adeofe, T.A., Camara, K., Camara, Y.H., Cissoko, K., Djiman, R., Mbye, E., Munroe, T., Sidibe, A., Tous, P., de Morais, L., Sagna, A. & Sylla, M. 2015. Cynoglossus monodi. The IUCN Red List of Threatened Species 2015: e.T15602466A15604025. Accessed on 29 June 2026.",Cynoglossus monodi,Guinean tonguesole,NT,Unknown,,,,species,,[],ACTINOPTERYGII,MARINEFISH,NT,Fishes (not comprehensive),True,False,NT,-13.754461979280947,8.188782206509156,range_polygon,1,1,1,1,1,200,1.0,1,Extant,1,Resident,15602466,self,679458.2582141823,679458.2582141823,679458.2582141823,,MARINEFISH_PART6.shp,International Union for Conservation of Nature,2015,IUCN 2025. The IUCN Red List of Threatened Species. Version 2025-2. https://www.iucnredlist.org. Downloaded on 14 June 2026.,10 October 2025,International Union for Conservation of Nature 2015. The IUCN Red List of Threatened Species. Version 2025-2. https://www.iucnredlist.org. Downloaded on 14 June 2026.
15602947,15604030,2012-05-15T01:00:00.000+01:00,2015,https://www.iucnredlist.org/species/15602947/15604030,"Adeofe, T.A., Camara, K., Camara, Y.H., Cissoko, K., Mbye, E., Munroe, T., Sidibe, A., Tous, P., de Morais, L., Sagna, A. & Sylla, M. 2015. Cynoglossus senegalensis. The IUCN Red List of Threatened Species 2015: e.T15602947A15604030. Accessed on 29 June 2026.",Cynoglossus senegalensis,Senegalese Tonguesole,NT,Stable,,,,species,,[],ACTINOPTERYGII,MARINEFISH,NT,Fishes (not comprehensive),True,False,NT,-1.9093197416259253,4.282630369679535,range_polygon,1,1,1,1,1,200,1.0,1,Extant,1,Resident,15602947,self,795271.4663539649,795271.4663539649,795271.4663539649,,MARINEFISH_PART7.shp,International Union for Conservation of Nature,2015,IUCN 2025. The IUCN Red List of Threatened Species. Version 2025-2. https://www.iucnredlist.org. Downloaded on 14 June 2026.,10 October 2025,International Union for Conservation of Nature 2015. The IUCN Red List of Threatened Species. Version 2025-2. https://www.iucnredlist.org. Downloaded on 14 June 2026.
15622639,15623347,2019-08-13T01:00:00.000+01:00,2020,https://www.iucnredlist.org/species/15622639/15623347,"Weerts, S.P., Munroe, T.A. & Nair, R. 2020. Heteromycteris capensis. The IUCN Red List of Threatened Species 2020: e.T15622639A15623347. Accessed on 29 June 2026.",Heteromycteris capensis,Cape Sole,NT,Unknown,,140-2000,,species,,[],ACTINOPTERYGII,MARINEFISH,NT,Fishes (not comprehensive),True,False,NT,16.193872478400948,-29.530369769958362,range_polygon,1,1,9,1,9,200,1.0,1,Extant,1,Resident,15622639,self,372784.14350594697,372784.14350594697,372784.14350594697,,MARINEFISH_PART2.shp,IUCN Marine Biodiversity Unit/GMSA,2020,IUCN 2025. The IUCN Red List of Threatened Species. Version 2025-2. https://www.iucnredlist.org. Downloaded on 14 June 2026.,10 October 2025,IUCN Marine Biodiversity Unit/GMSA 2020. The IUCN Red List of Threatened Species. Version 2025-2. https://www.iucnredlist.org. Downloaded on 14 June 2026.
16466393,16509787,2015-01-06T00:00:00.000+00:00,2015,https://www.iucnredlist.org/species/16466393/16509787,"Carpenter, K.E. 2015. Merluccius bilinearis. The IUCN Red List of Threatened Species 2015: e.T16466393A16509787. Accessed on 29 June 2026.",Merluccius bilinearis,Silver Hake,NT,Unknown,,,,species,,[],ACTINOPTERYGII,MARINEFISH,NT,Fishes (not comprehensive),True,False,NT,-74.03276775456288,38.76152993855676,range_polygon,1,1,1,1,1,200,1.0,1,Extant,1,Resident,16466393,self,1261232.395989237,1261232.395989237,1261232.395989237,,MARINEFISH_PART9.shp,International Union for Conservation of Nature,2015,IUCN 2025. The IUCN Red List of Threatened Species. Version 2025-2. https://www.iucnredlist.org. Downloaded on 14 June 2026.,10 October 2025,International Union for Conservation of Nature 2015. The IUCN Red List of Threatened Species. Version 2025-2. https://www.iucnredlist.org. Downloaded on 14 June 2026.
16545046,16546277,2013-01-29T00:00:00.000+00:00,2015,https://www.iucnredlist.org/species/16545046/16546277,"Aiken, K.A., Collette, B., Dooley, J., Kishore, R., Marechal, J., Pina Amargos, F. & Singh-Renton, S. 2015. Lopholatilus chamaeleonticeps. The IUCN Red List of Threatened Species 2015: e.T16545046A16546277. Accessed on 29 June 2026.",Lopholatilus chamaeleonticeps,Golden Tilefish,EN,Decreasing,,,,species,,[],ACTINOPTERYGII,MARINEFISH,EN,Fishes (not comprehensive),True,False,EN,-79.63217703344391,32.78982441221692,range_polygon,1,1,24,2,23,200,0.814740415081494,1,Extant,1,Resident,16545046,self,1248256.7567081049,1017005.2280886407,1017005.2280886407,,MARINEFISH_PART8.shp,International Union for Conservation of Nature,2015,IUCN 2025. The IUCN Red List of Threatened Species. Version 2025-2. https://www.iucnredlist.org. Downloaded on 14 June 2026.,10 October 2025,International Union for Conservation of Nature 2015. The IUCN Red List of Threatened Species. Version 2025-2. https://www.iucnredlist.org. Downloaded on 14 June 2026.
16759101,86415416,2020-01-07T00:00:00.000+00:00,2020,https://www.iucnredlist.org/species/16759101/86415416,"Moran, B.M. & Puebla, O. 2020. Hypoplectrus maya. The IUCN Red List of Threatened Species 2020: e.T16759101A86415416. Accessed on 29 June 2026.",Hypoplectrus maya,Maya Hamlet,EN,Decreasing,,360,871,species,,[],ACTINOPTERYGII,MARINEFISH,EN,Fishes (not comprehensive),True,False,EN,-88.23082751454572,16.42562923544872,range_polygon,1,1,1,1,1,200,1.0,1,Extant,1,Resident,16759101,self,1197.0133549683815,1197.0133549683815,1197.0133549683815,,MARINEFISH_PART4.shp,IUCN Marine Biodiversity Unit/GMSA,2020,IUCN 2025. The IUCN Red List of Threatened Species. Version 2025-2. https://www.iucnredlist.org. Downloaded on 14 June 2026.,10 October 2025,IUCN Marine Biodiversity Unit/GMSA 2020. The IUCN Red List of Threatened Species. Version 2025-2. https://www.iucnredlist.org. Downloaded on 14 June 2026.
18177478,42691864,2013-05-13T01:00:00.000+01:00,2015,https://www.iucnredlist.org/species/18177478/42691864,"Camara, K., Carpenter, K.E., Djiman, R., Nunoo, F., Sagna, A., Sidibé, A, Sylla, M., de Morais, L., Quartey, R. & Lindeman, K. 2015. Pseudupeneus prayensis. The IUCN Red List of Threatened Species 2015: e.T18177478A42691864. Accessed on 29 June 2026.",Pseudupeneus prayensis,West African Goatfish,VU,Decreasing,,,,species,,[],ACTINOPTERYGII,MARINEFISH,VU,Fishes (not comprehensive),True,False,VU,2.564084772890316,5.6170246364382095,range_polygon,1,1,4,2,3,200,0.9928760716378068,1,Extant,1,Resident,18177478,self,962830.9050709802,955971.7666783489,955971.7666783489,,MARINEFISH_PART3.shp,International Union for Conservation of Nature,2015,IUCN 2025. The IUCN Red List of Threatened Species. Version 2025-2. https://www.iucnredlist.org. Downloaded on 14 June 2026.,10 October 2025,International Union for Conservation of Nature 2015. The IUCN Red List of Threatened Species. Version 2025-2. https://www.iucnredlist.org. Downloaded on 14 June 2026.
18214757,162704857,2021-02-12T00:00:00.000+00:00,2022,https://www.iucnredlist.org/species/18214757/162704857,"Cadrin, S., González Troncoso, D., Nimmegeers, S., Vansteenbrugge, L., Wheeland, L. & Munroe, T.A. 2022. Glyptocephalus cynoglossus. The IUCN Red List of Threatened Species 2022: e.T18214757A162704857. Accessed on 29 June 2026.",Glyptocephalus cynoglossus,Witch Flounder,VU,Decreasing,,,,species,,[],ACTINOPTERYGII,MARINEFISH,VU,Fishes (not comprehensive),True,False,VU,0.06719104550621802,59.25987620944431,range_polygon,1,2,77,3,35,200,0.5554690392225299,1,Extant,1,Resident,18214757,self,2825803.900058459,1569646.57739675,1569646.57739675,,MARINEFISH_PART7.shp,IUCN Marine Biodiversity Unit/GMSA,2021,IUCN 2025. The IUCN Red List of Threatened Species. Version 2025-2. https://www.iucnredlist.org. Downloaded on 14 June 2026.,10 October 2025,IUCN Marine Biodiversity Unit/GMSA 2021. The IUCN Red List of Threatened Species. Version 2025-2. https://www.iucnredlist.org. Downloaded on 14 June 2026.
18214757,162704857,2021-02-12T00:00:00.000+00:00,2022,https://www.iucnredlist.org/species/18214757/162704857,"Cadrin, S., González Troncoso, D., Nimmegeers, S., Vansteenbrugge, L., Wheeland, L. & Munroe, T.A. 2022. Glyptocephalus cynoglossus. The IUCN Red List of Threatened Species 2022: e.T18214757A162704857. Accessed on 29 June 2026.",Glyptocephalus cynoglossus,Witch Flounder,VU,Decreasing,,,,species,,[],ACTINOPTERYGII,MARINEFISH,VU,Fishes (not comprehensive),True,False,VU,-60.817198075910255,45.169056839501614,range_polygon,2,2,77,3,24,200,0.37140744787141516,1,Extant,1,Resident,18214757,self,2825803.900058459,1049524.6147058038,1049524.6147058038,,MARINEFISH_PART7.shp,IUCN Marine Biodiversity Unit/GMSA,2021,IUCN 2025. The IUCN Red List of Threatened Species. Version 2025-2. https://www.iucnredlist.org. Downloaded on 14 June 2026.,10 October 2025,IUCN Marine Biodiversity Unit/GMSA 2021. The IUCN Red List of Threatened Species. Version 2025-2. https://www.iucnredlist.org. Downloaded on 14 June 2026.
18214783,162705101,2021-02-12T00:00:00.000+00:00,2022,https://www.iucnredlist.org/species/18214783/162705101,"Cadrin, S., González Troncoso, D., Wheeland, L. & Munroe, T.A. 2022. Hippoglossoides platessoides. The IUCN Red List of Threatened Species 2022: e.T18214783A162705101. Accessed on 29 June 2026.",Hippoglossoides platessoides,American Plaice,EN,Decreasing,,,,species,,[],ACTINOPTERYGII,MARINEFISH,EN,Fishes (not comprehensive),True,False,EN,-17.957550922694345,66.62804066387481,range_polygon,1,1,88,2,87,200,0.999999115452466,1,Extant,1,Resident,18214783,self,7032634.039036937,7032627.81833784,7032627.81833784,,MARINEFISH_PART8.shp,IUCN Marine Biodiversity Unit/GMSA,2021,IUCN 2025. The IUCN Red List of Threatened Species. Version 2025-2. https://www.iucnredlist.org. Downloaded on 14 June 2026.,10 October 2025,IUCN Marine Biodiversity Unit/GMSA 2021. The IUCN Red List of Threatened Species. Version 2025-2. https://www.iucnredlist.org. Downloaded on 14 June 2026.
18227054,148037259,2021-02-24T00:00:00.000+00:00,2022,https://www.iucnredlist.org/species/18227054/148037259,"Bryan, M., Cadrin, S., Carpenter, K.E., González Troncoso, D., Hallfredsson, E., Munroe, T.A., Orlov, A.M., Spies, I., Stevenson, D., Volvenko, I.V. & Wheeland, L. 2022. Reinhardtius hippoglossoides. The IUCN Red List of Threatened Species 2022: e.T18227054A148037259. Accessed on 29 June 2026.",Reinhardtius hippoglossoides,Greenland Halibut,NT,Decreasing,,,,species,,[],ACTINOPTERYGII,MARINEFISH,NT,Fishes (not comprehensive),True,False,NT,0.7872148628836428,61.3760146426,range_polygon,1,2,95,3,46,200,0.5569814236789749,1,Extant,1,Resident,18227054,self,11867755.178435337,6610119.17515844,6610119.17515844,,MARINEFISH_PART2.shp,IUCN Marine Biodiversity Unit/GMSA,2021,IUCN 2025. The IUCN Red List of Threatened Species. Version 2025-2. https://www.iucnredlist.org. Downloaded on 14 June 2026.,10 October 2025,IUCN Marine Biodiversity Unit/GMSA 2021. The IUCN Red List of Threatened Species. Version 2025-2. https://www.iucnredlist.org. Downloaded on 14 June 2026.
18227054,148037259,2021-02-24T00:00:00.000+00:00,2022,https://www.iucnredlist.org/species/18227054/148037259,"Bryan, M., Cadrin, S., Carpenter, K.E., González Troncoso, D., Hallfredsson, E., Munroe, T.A., Orlov, A.M., Spies, I., Stevenson, D., Volvenko, I.V. & Wheeland, L. 2022. Reinhardtius hippoglossoides. The IUCN Red List of Threatened Species 2022: e.T18227054A148037259. Accessed on 29 June 2026.",Reinhardtius hippoglossoides,Greenland Halibut,NT,Decreasing,,,,species,,[],ACTINOPTERYGII,MARINEFISH,NT,Fishes (not comprehensive),True,False,NT,-172.50626373859092,60.773391652554295,range_polygon,2,2,95,3,2,200,0.2452881410387098,1,Extant,1,Resident,18227054,self,11867755.178435337,2911019.6060209256,2911019.6060209256,,MARINEFISH_PART2.shp,IUCN Marine Biodiversity Unit/GMSA,2021,IUCN 2025. The IUCN Red List of Threatened Species. Version 2025-2. https://www.iucnredlist.org. Downloaded on 14 June 2026.,10 October 2025,IUCN Marine Biodiversity Unit/GMSA 2021. The IUCN Red List of Threatened Species. Version 2025-2. https://www.iucnredlist.org. Downloaded on 14 June 2026.
20433018,67871620,2017-07-19T01:00:00.000+01:00,2018,https://www.iucnredlist.org/species/20433018/67871620,"Smith-Vaniz, W.F., Carpenter, K.E., Jiddawi, N., Borsa, P., Obota, C. & Yahya, S. 2018. Pseudocaranx chilensis. The IUCN Red List of Threatened Species 2018: e.T20433018A67871620. Accessed on 29 June 2026.",Pseudocaranx chilensis,Juan Fernandez Mackerel,VU,Decreasing,,724,290765,species,,[],ACTINOPTERYGII,MARINEFISH,VU,Fishes (not comprehensive),True,False,VU,-79.77255606527028,-33.70648073593282,range_polygon,1,2,2,2,1,200,0.6597325714350376,1,Extant,1,Resident,20433018,self,107831.75609362098,71140.12173000035,71140.12173000035,,MARINEFISH_PART8.shp,IUCN Marine Biodiversity Unit/GMSA,2018,IUCN 2025. The IUCN Red List of Threatened Species. Version 2025-2. https://www.iucnredlist.org. Downloaded on 14 June 2026.,10 October 2025,IUCN Marine Biodiversity Unit/GMSA 2018. The IUCN Red List of Threatened Species. Version 2025-2. https://www.iucnredlist.org. Downloaded on 14 June 2026.
20433018,67871620,2017-07-19T01:00:00.000+01:00,2018,https://www.iucnredlist.org/species/20433018/67871620,"Smith-Vaniz, W.F., Carpenter, K.E., Jiddawi, N., Borsa, P., Obota, C. & Yahya, S. 2018. Pseudocaranx chilensis. The IUCN Red List of Threatened Species 2018: e.T20433018A67871620. Accessed on 29 June 2026.",Pseudocaranx chilensis,Juan Fernandez Mackerel,VU,Decreasing,,724,290765,species,,[],ACTINOPTERYGII,MARINEFISH,VU,Fishes (not comprehensive),True,False,VU,-79.9973641973532,-26.32392533766608,range_polygon,2,2,2,2,1,200,0.34026742856496245,1,Extant,1,Resident,20433018,self,107831.75609362098,36691.63436362063,36691.63436362063,,MARINEFISH_PART8.shp,IUCN Marine Biodiversity Unit/GMSA,2018,IUCN 2025. The IUCN Red List of Threatened Species. Version 2025-2. https://www.iucnredlist.org. Downloaded on 14 June 2026.,10 October 2025,IUCN Marine Biodiversity Unit/GMSA 2018. The IUCN Red List of Threatened Species. Version 2025-2. https://www.iucnredlist.org. Downloaded on 14 June 2026.
20437726,46664154,2017-07-20T01:00:00.000+01:00,2018,https://www.iucnredlist.org/species/20437726/46664154,"Smith-Vaniz, W.F., Carpenter, K.E., Borsa, P., Jiddawi, N., Yahya, S. & Obota, C. 2018. Trachurus indicus. The IUCN Red List of Threatened Species 2018: e.T20437726A46664154. Accessed on 29 June 2026.",Trachurus indicus,Arabian Scad,VU,Decreasing,,,,species,,[],ACTINOPTERYGII,MARINEFISH,VU,Fishes (not comprehensive),True,False,VU,49.0445545255552,13.943902939484733,range_polygon,1,1,4,2,3,200,0.955897052822735,1,Extant,1,Resident,20437726,self,1624083.0083768987,1552456.1612469587,1552456.1612469587,,MARINEFISH_PART5.shp,IUCN Marine Biodiversity Unit/GMSA,2018,IUCN 2025. The IUCN Red List of Threatened Species. Version 2025-2. https://www.iucnredlist.org. Downloaded on 14 June 2026.,10 October 2025,IUCN Marine Biodiversity Unit/GMSA 2018. The IUCN Red List of Threatened Species. Version 2025-2. https://www.iucnredlist.org. Downloaded on 14 June 2026.
